Authors,Author(s) ID,Title,Year,Source title,Volume,Issue,Art. No.,Page start,Page end,Page count,Cited by,DOI,Link,Affiliations,Authors with affiliations,Document Type,Publication Stage,Open Access,Source,EID
"Jiang S., Kahn J.","57191191820;56734077300;","Data wrangling practices and collaborative interactions with aggregated data",2020,"International Journal of Computer-Supported Collaborative Learning","15","3",,"257","281",,5,"10.1007/s11412-020-09327-1","https://www.scopus.com/inward/record.uri?eid=2-s2.0-85089857133&doi=10.1007%2fs11412-020-09327-1&partnerID=40&md5=44f4576656c4d8f60fdf9ccbd17fe00a","Department of Teacher Education and Learning Sciences, North Carolina State University, Poe Hall, 208, 2310 Stinson Dr, Raleigh, NC  27695, United States; University of Miami, Coral Gables, FL, United States","Jiang, S., Department of Teacher Education and Learning Sciences, North Carolina State University, Poe Hall, 208, 2310 Stinson Dr, Raleigh, NC  27695, United States; Kahn, J., University of Miami, Coral Gables, FL, United States",Article,"Final","",Scopus,2-s2.0-85089857133
"Mike K.","57218096276;","Data Science Education: Curriculum and pedagogy",2020,"ICER 2020 - Proceedings of the 2020 ACM Conference on International Computing Education Research",,,,"324","325",,5,"10.1145/3372782.3407110","https://www.scopus.com/inward/record.uri?eid=2-s2.0-85092130901&doi=10.1145%2f3372782.3407110&partnerID=40&md5=34370faa52f260ee42a627055e6faab0","Technion - Israel Institute of Technology, Haifa, Israel","Mike, K., Technion - Israel Institute of Technology, Haifa, Israel",Conference Paper,"Final","",Scopus,2-s2.0-85092130901
"Arquilla J., Roschelle J.","6507129586;6603548311;","How WWII was won, and why CS students feel unappreciated",2020,"Communications of the ACM","63","8",,"6","7",,,"10.1145/3403958","https://www.scopus.com/inward/record.uri?eid=2-s2.0-85089275637&doi=10.1145%2f3403958&partnerID=40&md5=e78e6bb13db999ea59619a667478a3f7","United States Naval Postgraduate School, United States; Digital Promise","Arquilla, J., United States Naval Postgraduate School, United States; Roschelle, J., Digital Promise",Article,"Final","",Scopus,2-s2.0-85089275637
"Bile Hassan I., Liu J.","57211156967;15623441100;","A Comparative Study of the Academic Programs between Informatics/BioInformatics and Data Science in the U.S.",2020,"Proceedings - 2020 IEEE 44th Annual Computers, Software, and Applications Conference, COMPSAC 2020",,,"9202643","165","171",,3,"10.1109/COMPSAC48688.2020.00030","https://www.scopus.com/inward/record.uri?eid=2-s2.0-85094162025&doi=10.1109%2fCOMPSAC48688.2020.00030&partnerID=40&md5=b7f2c8615c91ead3838cf09c297d55be","Department of Computer Science and Cybersecurity Metropolitan State, University St. Paul, Minnesota, United States","Bile Hassan, I., Department of Computer Science and Cybersecurity Metropolitan State, University St. Paul, Minnesota, United States; Liu, J., Department of Computer Science and Cybersecurity Metropolitan State, University St. Paul, Minnesota, United States",Conference Paper,"Final","",Scopus,2-s2.0-85094162025
"Davis K.C.","7403210248;","Ethics in data science education",2020,"ASEE Annual Conference and Exposition, Conference Proceedings","2020-June",,"632","","",,,,"https://www.scopus.com/inward/record.uri?eid=2-s2.0-85095737074&partnerID=40&md5=88b6a4822704b7c67fdbb0f7d25ba248","Miami University, United States","Davis, K.C., Miami University, United States",Conference Paper,"Final","",Scopus,2-s2.0-85095737074
"Hagen L.","55681353800;","Teaching data science to social sciences and humanities students",2020,"ACM International Conference Proceeding Series",,,,"363","364",,2,"10.1145/3396956.3396968","https://www.scopus.com/inward/record.uri?eid=2-s2.0-85086903052&doi=10.1145%2f3396956.3396968&partnerID=40&md5=13d118f71756ed0554f5cc043bb82dde","University of South Florida, Tampa, FL, United States","Hagen, L., University of South Florida, Tampa, FL, United States",Conference Paper,"Final","",Scopus,2-s2.0-85086903052
"Liu Y., Wei X.","36967904700;57209224551;","How to use stock data for data science education: A simulated trading platform in classroom",2020,"Proceedings of 2nd International Conference on Computer Science and Educational Informatization, CSEI 2020",,,"9142534","5","8",,1,"10.1109/CSEI50228.2020.9142534","https://www.scopus.com/inward/record.uri?eid=2-s2.0-85092489291&doi=10.1109%2fCSEI50228.2020.9142534&partnerID=40&md5=d5295fe7f12824c09bbe1a1a639f7cb6","Gannon University, Department of Computer and Information Science, Erie, PA, United States; Gannon University, Department of Management, Erie, PA, United States","Liu, Y., Gannon University, Department of Computer and Information Science, Erie, PA, United States; Wei, X., Gannon University, Department of Management, Erie, PA, United States",Conference Paper,"Final","",Scopus,2-s2.0-85092489291
"DeMasi O., Paxton A., Koy K.","55185068000;55618999100;57216728772;","Ad hoc efforts for advancing data science education",2020,"PLoS Computational Biology","16","5","e1007695","","",,2,"10.1371/journal.pcbi.1007695","https://www.scopus.com/inward/record.uri?eid=2-s2.0-85084401921&doi=10.1371%2fjournal.pcbi.1007695&partnerID=40&md5=fdd36622a7c0e25b4d8f0ef87c85fb06","Department of Computer Science, University of California, Davis, CA, United States; Department of Psychological Sciences, University of Connecticut, Storrs, CT, United States; Center for the Ecological Study of Perception and Action, University of Connecticut, Storrs, CT, United States; IDEO, San Francisco, CA, United States","DeMasi, O., Department of Computer Science, University of California, Davis, CA, United States; Paxton, A., Department of Psychological Sciences, University of Connecticut, Storrs, CT, United States, Center for the Ecological Study of Perception and Action, University of Connecticut, Storrs, CT, United States; Koy, K., IDEO, San Francisco, CA, United States",Article,"Final","All Open Access, Gold, Green",Scopus,2-s2.0-85084401921
"Shapiro B.R., Meng A., O'Donnell C., Lou C., Zhao E., Dankwa B., Hostetler A.","57194265266;57072886400;57219114846;57212168445;57219109585;57219108691;55790478300;","Re-Shape: A Method to Teach Data Ethics for Data Science Education",2020,"Conference on Human Factors in Computing Systems - Proceedings",,,"3376251","","",,18,"10.1145/3313831.3376251","https://www.scopus.com/inward/record.uri?eid=2-s2.0-85091281185&doi=10.1145%2f3313831.3376251&partnerID=40&md5=95d4b541dd370e44a2de9668b74adb34","Georgia Institute of Technology, Atlanta, CA, United States; Vanderbilt University, Nashville, TN, United States","Shapiro, B.R., Georgia Institute of Technology, Atlanta, CA, United States; Meng, A., Georgia Institute of Technology, Atlanta, CA, United States; O'Donnell, C., Georgia Institute of Technology, Atlanta, CA, United States; Lou, C., Georgia Institute of Technology, Atlanta, CA, United States; Zhao, E., Georgia Institute of Technology, Atlanta, CA, United States; Dankwa, B., Georgia Institute of Technology, Atlanta, CA, United States; Hostetler, A., Vanderbilt University, Nashville, TN, United States",Conference Paper,"Final","All Open Access, Green",Scopus,2-s2.0-85091281185
"Yu W., Peng W., Shu Y., Zeng Q., Jiang M.","57209227271;57216691638;57217167737;57203392375;36179647500;","Experimental Evidence Extraction System in Data Science with Hybrid Table Features and Ensemble Learning",2020,"The Web Conference 2020 - Proceedings of the World Wide Web Conference, WWW 2020",,,,"951","961",,5,"10.1145/3366423.3380174","https://www.scopus.com/inward/record.uri?eid=2-s2.0-85086564134&doi=10.1145%2f3366423.3380174&partnerID=40&md5=881452afbca7557657a7f604732f7afd","Department of Computer Science and Engineering, University of Notre Dame, Notre Dame, United States","Yu, W., Department of Computer Science and Engineering, University of Notre Dame, Notre Dame, United States; Peng, W., Department of Computer Science and Engineering, University of Notre Dame, Notre Dame, United States; Shu, Y., Department of Computer Science and Engineering, University of Notre Dame, Notre Dame, United States; Zeng, Q., Department of Computer Science and Engineering, University of Notre Dame, Notre Dame, United States; Jiang, M., Department of Computer Science and Engineering, University of Notre Dame, Notre Dame, United States",Conference Paper,"Final","",Scopus,2-s2.0-85086564134
"Mike K., Nemirovsky-Rotman S., Hazzan O.","57218096276;9632600600;6603726112;","Interdisciplinary education - The case of biomedical signal processing",2020,"IEEE Global Engineering Education Conference, EDUCON","2020-April",,"9125200","339","343",,1,"10.1109/EDUCON45650.2020.9125200","https://www.scopus.com/inward/record.uri?eid=2-s2.0-85087907017&doi=10.1109%2fEDUCON45650.2020.9125200&partnerID=40&md5=9ed7c15ae04d8ada0079a8901a7ddb25","Technion - Israel Institute of Technology, Faculty of Educaion in Science and Technology, Haifa, Israel; Technion - Israel Institute of Technology, Faculty of Electrical Engineering, Haifa, Israel","Mike, K., Technion - Israel Institute of Technology, Faculty of Educaion in Science and Technology, Haifa, Israel; Nemirovsky-Rotman, S., Technion - Israel Institute of Technology, Faculty of Electrical Engineering, Haifa, Israel; Hazzan, O., Technion - Israel Institute of Technology, Faculty of Educaion in Science and Technology, Haifa, Israel",Conference Paper,"Final","",Scopus,2-s2.0-85087907017
"Nair R., Chugani M.N., Thangavel S.K.","57220707832;57217048830;57195940323;","MetaData: A Tool to Supplement Data Science Education for the First Year Undergraduates",2020,"ACM International Conference Proceeding Series",,,,"153","160",,,"10.1145/3395245.3396409","https://www.scopus.com/inward/record.uri?eid=2-s2.0-85085932752&doi=10.1145%2f3395245.3396409&partnerID=40&md5=bcb5ae978243574c79fd577b1ea92043","Amrita School of Engineering, Amrita Vishwa Vidyapeetham, Coimbatore, India","Nair, R., Amrita School of Engineering, Amrita Vishwa Vidyapeetham, Coimbatore, India; Chugani, M.N., Amrita School of Engineering, Amrita Vishwa Vidyapeetham, Coimbatore, India; Thangavel, S.K., Amrita School of Engineering, Amrita Vishwa Vidyapeetham, Coimbatore, India",Conference Paper,"Final","",Scopus,2-s2.0-85085932752
"Bhavya, Boughoula A., Green A., Zhai C.X.","57210734881;57194033401;57210730993;35232046000;","Collective development of large scale data science products via modularized assignments: An experience report",2020,"SIGCSE 2020 - Proceedings of the 51st ACM Technical Symposium on Computer Science Education",,,,"1200","1206",,3,"10.1145/3328778.3366961","https://www.scopus.com/inward/record.uri?eid=2-s2.0-85081537039&doi=10.1145%2f3328778.3366961&partnerID=40&md5=03e8b01a6301465986d4cda0d9d86dd2","University of Illinois, Urbana-Champaign, United States","Bhavya, University of Illinois, Urbana-Champaign, United States; Boughoula, A., University of Illinois, Urbana-Champaign, United States; Green, A., University of Illinois, Urbana-Champaign, United States; Zhai, C.X., University of Illinois, Urbana-Champaign, United States",Conference Paper,"Final","All Open Access, Bronze",Scopus,2-s2.0-85081537039
"Kloefkorn T., Boardman M., Horton N.J., Marshall B.","56400986200;57212433422;7006630050;24490965300;","National academies' roundtable on data science postsecondary education",2020,"SIGCSE 2020 - Proceedings of the 51st ACM Technical Symposium on Computer Science Education",,,,"956","957",,,"10.1145/3328778.3366986","https://www.scopus.com/inward/record.uri?eid=2-s2.0-85081534201&doi=10.1145%2f3328778.3366986&partnerID=40&md5=3ef00dd30c3eafeee5cdc13bc2fdb14f","National Academies of Sciences, Engineering, and Medicine, Washington, DC, United States; Mathematics Department Pacific, University Forest GroveOR, United States; Department of Mathematics and Statistics, Amherst College, Amherst, MA, United States; Department of Computer and Information Sciences Spelman, College AtlantaGA  30314, United States","Kloefkorn, T., National Academies of Sciences, Engineering, and Medicine, Washington, DC, United States; Boardman, M., Mathematics Department Pacific, University Forest GroveOR, United States; Horton, N.J., Department of Mathematics and Statistics, Amherst College, Amherst, MA, United States; Marshall, B., Department of Computer and Information Sciences Spelman, College AtlantaGA  30314, United States",Conference Paper,"Final","",Scopus,2-s2.0-85081534201
"Kross S., Peng R.D., Caffo B.S., Gooding I., Leek J.T.","57191953476;8297055600;35069047000;55488736900;8558142900;","The Democratization of Data Science Education",2020,"American Statistician","74","1",,"1","7",,15,"10.1080/00031305.2019.1668849","https://www.scopus.com/inward/record.uri?eid=2-s2.0-85074567757&doi=10.1080%2f00031305.2019.1668849&partnerID=40&md5=4efdeb74b140e1a57860f49f2542163a","Department of Cognitive Science, The University of California San Diego, La Jolla, CA, United States; Department of Biostatistics, Johns Hopkins Bloomberg School of Public Health, Baltimore, MD, United States; Center for Teaching and Learning, Johns Hopkins Bloomberg School of Public Health, Baltimore, MD, United States","Kross, S., Department of Cognitive Science, The University of California San Diego, La Jolla, CA, United States; Peng, R.D., Department of Biostatistics, Johns Hopkins Bloomberg School of Public Health, Baltimore, MD, United States; Caffo, B.S., Department of Biostatistics, Johns Hopkins Bloomberg School of Public Health, Baltimore, MD, United States; Gooding, I., Center for Teaching and Learning, Johns Hopkins Bloomberg School of Public Health, Baltimore, MD, United States; Leek, J.T., Department of Biostatistics, Johns Hopkins Bloomberg School of Public Health, Baltimore, MD, United States",Article,"Final","",Scopus,2-s2.0-85074567757
"Siluo Y., Yiming Z.","35333006700;42162431300;","The Interdisciplinary Characteristics of iSchools Research:From the Perspective of Biblimetrics Analysis",2020,"Journal of Library Science in China","46","6",,"55","74",,,"10.13530/j.cnki.jlis.2020048","https://www.scopus.com/inward/record.uri?eid=2-s2.0-85127824541&doi=10.13530%2fj.cnki.jlis.2020048&partnerID=40&md5=9ed601c3996a0fefe26d026d10b33d38","School of Information Management, Wuhan University, Wuhan Hubei, 430072, China","Siluo, Y., School of Information Management, Wuhan University, Wuhan Hubei, 430072, China; Yiming, Z., School of Information Management, Wuhan University, Wuhan Hubei, 430072, China",Article,"Final","",Scopus,2-s2.0-85127824541
"Zhang J., Wu B.","57213199902;57213495940;","Self and socially shared regulation of learning in data science education: A case study of “Quantified self” project",2020,"Computer-Supported Collaborative Learning Conference, CSCL","2",,,"749","750",,,,"https://www.scopus.com/inward/record.uri?eid=2-s2.0-85102903495&partnerID=40&md5=a8f3283b38c73f3f66bc72cd1bdfed95","East China Normal University, China","Zhang, J., East China Normal University, China; Wu, B., East China Normal University, China",Conference Paper,"Final","",Scopus,2-s2.0-85102903495
"Hagen L.","55681353800;","Teaching undergraduate data science for information schools",2020,"Education for Information","36","2",,"109","117",,2,"10.3233/EFI-200372","https://www.scopus.com/inward/record.uri?eid=2-s2.0-85089572100&doi=10.3233%2fEFI-200372&partnerID=40&md5=d4eec4088a6b6ea25efa598885ede3f0","School of Information, University of South FloridaFL, United States","Hagen, L., School of Information, University of South FloridaFL, United States",Article,"Final","",Scopus,2-s2.0-85089572100
"Hauser E., Sutherland W.","57208335276;57201354287;","Temporality in data science education: Early results from a grounded theory study of an NSF-funded cybertraining workshop",2020,"Lecture Notes in Computer Science (including subseries Lecture Notes in Artificial Intelligence and Lecture Notes in Bioinformatics)","12051 LNCS",,,"536","544",,,"10.1007/978-3-030-43687-2_43","https://www.scopus.com/inward/record.uri?eid=2-s2.0-85084172253&doi=10.1007%2f978-3-030-43687-2_43&partnerID=40&md5=aa10367e1bacb6b0a2f83f09c8b97202","The University of North Carolina at Chapel Hill, Chapel Hill, NC, United States; University of Washington, Seattle, WA, United States","Hauser, E., The University of North Carolina at Chapel Hill, Chapel Hill, NC, United States; Sutherland, W., University of Washington, Seattle, WA, United States",Conference Paper,"Final","",Scopus,2-s2.0-85084172253
"Wilkerson M.H., Polman J.L.","36854812900;7004242328;","Situating Data Science: Exploring How Relationships to Data Shape Learning",2020,"Journal of the Learning Sciences","29","1",,"1","10",,26,"10.1080/10508406.2019.1705664","https://www.scopus.com/inward/record.uri?eid=2-s2.0-85076898036&doi=10.1080%2f10508406.2019.1705664&partnerID=40&md5=f79aab7a90189eedba91b4515689005b","Graduate School of Education, University of California, Berkeley, United States; School of Education, University of Colorado Boulder, United States","Wilkerson, M.H., Graduate School of Education, University of California, Berkeley, United States; Polman, J.L., School of Education, University of Colorado Boulder, United States",Article,"Final","",Scopus,2-s2.0-85076898036
"Kahn J.","56734077300;","Learning at the Intersection of Self and Society: The Family Geobiography as a Context for Data Science Education",2020,"Journal of the Learning Sciences","29","1",,"57","80",,15,"10.1080/10508406.2019.1693377","https://www.scopus.com/inward/record.uri?eid=2-s2.0-85076381106&doi=10.1080%2f10508406.2019.1693377&partnerID=40&md5=6afa2e546149ae032f94b720dc80e689","Department of Teaching and Learning, University of Miami, United States","Kahn, J., Department of Teaching and Learning, University of Miami, United States",Article,"Final","",Scopus,2-s2.0-85076381106
"Roberts J., Lyons L.","55277408700;22835475800;","Examining Spontaneous Perspective Taking and Fluid Self-to-Data Relationships in Informal Open-Ended Data Exploration",2020,"Journal of the Learning Sciences","29","1",,"32","56",,20,"10.1080/10508406.2019.1651317","https://www.scopus.com/inward/record.uri?eid=2-s2.0-85072064921&doi=10.1080%2f10508406.2019.1651317&partnerID=40&md5=ec39d9e5fec2e77eead3c717fe476dbe","Computer Science and Learning Sciences Research Institute, University of Illinois-Chicago, United States; Research Department, New York Hall of Science, United States; School of Interactive Computing, Georgia Institute of Technolog, United States","Roberts, J., Computer Science and Learning Sciences Research Institute, University of Illinois-Chicago, United States, School of Interactive Computing, Georgia Institute of Technolog, United States; Lyons, L., Computer Science and Learning Sciences Research Institute, University of Illinois-Chicago, United States, Research Department, New York Hall of Science, United States",Article,"Final","",Scopus,2-s2.0-85072064921
"Miah S.J., Solomonides I., Gammack J.G.","24178573200;55515578700;6701716040;","A design-based research approach for developing data-focussed business curricula",2020,"Education and Information Technologies","25","1",,"553","581",,7,"10.1007/s10639-019-09981-5","https://www.scopus.com/inward/record.uri?eid=2-s2.0-85070315017&doi=10.1007%2fs10639-019-09981-5&partnerID=40&md5=03806daff9c56acef02bd59712c4facf","Victoria University, Footscray Park Campus, Footscray, Melbourne, Australia; College of Technological Innovation at Zayed University, Dubai, United Arab Emirates","Miah, S.J., Victoria University, Footscray Park Campus, Footscray, Melbourne, Australia; Solomonides, I., Victoria University, Footscray Park Campus, Footscray, Melbourne, Australia; Gammack, J.G., College of Technological Innovation at Zayed University, Dubai, United Arab Emirates",Article,"Final","",Scopus,2-s2.0-85070315017
[No author name available],[No author id available],"21st International Conference on Interactive Collaborative Learning, ICL 2018",2020,"Advances in Intelligent Systems and Computing","916",,,"","",1963,,,"https://www.scopus.com/inward/record.uri?eid=2-s2.0-85064707039&partnerID=40&md5=9c828990c07bb13aab35d85ddb4e17f4",,"",Conference Review,"Final","",Scopus,2-s2.0-85064707039
"Maksimenkova O., Neznanov A., Radchenko I.","57191339634;55329014600;56724746000;","Collaborative Learning in Data Science Education: A Data Expedition as a Formative Assessment Tool",2020,"Advances in Intelligent Systems and Computing","916",,,"14","25",,,"10.1007/978-3-030-11932-4_2","https://www.scopus.com/inward/record.uri?eid=2-s2.0-85064639030&doi=10.1007%2f978-3-030-11932-4_2&partnerID=40&md5=d6b06e7013bd97995bfd2b2faf2769ee","National Research University Higher School of Economics, Moscow, Russian Federation; ITMO University, St. Petersburg, Russian Federation","Maksimenkova, O., National Research University Higher School of Economics, Moscow, Russian Federation; Neznanov, A., National Research University Higher School of Economics, Moscow, Russian Federation; Radchenko, I., ITMO University, St. Petersburg, Russian Federation",Conference Paper,"Final","",Scopus,2-s2.0-85064639030
"Raj R.K., Parrish A., Impagliazzo J., Romanowski C.J., Aly S.G., Bennett C.C., Davis K.C., McGettrick A., Pereira T.S.M., Sundin L.","7102994746;57531605700;6701638685;7003743523;22733763800;15764315800;7403210248;57223395790;35097611700;57193589372;","An empirical approach to understanding data science and engineering education",2019,"Annual Conference on Innovation and Technology in Computer Science Education, ITiCSE",,,,"73","87",,4,"10.1145/3344429.3372503","https://www.scopus.com/inward/record.uri?eid=2-s2.0-85079340997&doi=10.1145%2f3344429.3372503&partnerID=40&md5=618d938b035beb24b0a2b7010d375ebf","Rochester Institute of Technology, Rochester, NY, United States; Mississippi State University, Mississippi State, MS, United States; Hofstra University, Hempstead, NY, United States; American University in Cairo, Cairo, Egypt; DePaul University, Chicago, IL, United States; Miami University, Oxford, OH, United States; Strathclyde University, Strathclyde, United Kingdom; Inst. Politécnico de Viana do Castelo, Viana do Castelo, Portugal; University of Glasgow, Glasgow, United Kingdom","Raj, R.K., Rochester Institute of Technology, Rochester, NY, United States; Parrish, A., Mississippi State University, Mississippi State, MS, United States; Impagliazzo, J., Hofstra University, Hempstead, NY, United States; Romanowski, C.J., Rochester Institute of Technology, Rochester, NY, United States; Aly, S.G., American University in Cairo, Cairo, Egypt; Bennett, C.C., DePaul University, Chicago, IL, United States; Davis, K.C., Miami University, Oxford, OH, United States; McGettrick, A., Strathclyde University, Strathclyde, United Kingdom; Pereira, T.S.M., Inst. Politécnico de Viana do Castelo, Viana do Castelo, Portugal; Sundin, L., University of Glasgow, Glasgow, United Kingdom",Conference Paper,"Final","",Scopus,2-s2.0-85079340997
"Price R., Ramaswamy L.","56146569100;16069392500;","Challenges and approaches to teaching data science technologies in an information technology program with non-traditional students",2019,"Proceedings - 2019 IEEE 5th International Conference on Collaboration and Internet Computing, CIC 2019",,,"8998478","49","56",,,"10.1109/CIC48465.2019.00015","https://www.scopus.com/inward/record.uri?eid=2-s2.0-85080885783&doi=10.1109%2fCIC48465.2019.00015&partnerID=40&md5=04b4c726d31bcdbd8443f169f903062f","Information Technology, Georgia Gwinnett College, Lawrenceville, United States; Computer Science, University of Georgia, Athens, United States","Price, R., Information Technology, Georgia Gwinnett College, Lawrenceville, United States; Ramaswamy, L., Computer Science, University of Georgia, Athens, United States",Conference Paper,"Final","",Scopus,2-s2.0-85080885783
