Authors,Author(s) ID,Title,Year,Source title,Volume,Issue,Art. No.,Page start,Page end,Page count,Cited by,DOI,Link,Affiliations,Authors with affiliations,Document Type,Publication Stage,Open Access,Source,EID
"Blair J.R.S., Jones L., Leidig P., Murray S., Raj R.K., Romanowski C.J.","7203040282;57216285406;6701820291;57204967831;7102994746;7003743523;","Establishing ABET Accreditation Criteria for Data Science",2021,"SIGCSE 2021 - Proceedings of the 52nd ACM Technical Symposium on Computer Science Education",,,,"535","540",,5,"10.1145/3408877.3432445","https://www.scopus.com/inward/record.uri?eid=2-s2.0-85103336031&doi=10.1145%2f3408877.3432445&partnerID=40&md5=1d5f7364bccfb97c84ad1945a458943f","United States Military Academy, West Point, NY, United States; Abet Inc., Baltimore, MD, United States; Grand Valley State University, Allendale, MI, United States; Hca Healthcare Inc., Kennesaw, GA, United States; Rochester Institute of Technology, Rochester, NY, United States","Blair, J.R.S., United States Military Academy, West Point, NY, United States; Jones, L., Abet Inc., Baltimore, MD, United States; Leidig, P., Grand Valley State University, Allendale, MI, United States; Murray, S., Hca Healthcare Inc., Kennesaw, GA, United States; Raj, R.K., Rochester Institute of Technology, Rochester, NY, United States; Romanowski, C.J., Rochester Institute of Technology, Rochester, NY, United States",Conference Paper,"Final","",Scopus,2-s2.0-85103336031
"Allen G.I.","56799858800;","Experiential Learning in Data Science: Developing an Interdisciplinary, Client-Sponsored Capstone Program",2021,"SIGCSE 2021 - Proceedings of the 52nd ACM Technical Symposium on Computer Science Education",,,,"516","522",,3,"10.1145/3408877.3432536","https://www.scopus.com/inward/record.uri?eid=2-s2.0-85103307915&doi=10.1145%2f3408877.3432536&partnerID=40&md5=1625ac07baa155714d3e05fe8bb4ef91","Rice University, Houston, TX, United States","Allen, G.I., Rice University, Houston, TX, United States",Conference Paper,"Final","",Scopus,2-s2.0-85103307915
"Shao G., Quintana J.P., Zakharov W., Purzer S., Kim E.","56425175400;57208001216;57192591588;25655239900;57200528363;","Exploring potential roles of academic libraries in undergraduate data science education curriculum development",2021,"Journal of Academic Librarianship","47","2","102320","","",,1,"10.1016/j.acalib.2021.102320","https://www.scopus.com/inward/record.uri?eid=2-s2.0-85100143048&doi=10.1016%2fj.acalib.2021.102320&partnerID=40&md5=46c1a5b9c06e1a3c89c95e4fbcb422d4","Purdue University Libraries and School of Information Studies, West Lafayette, IN  47907, United States; Purdue University School of Engineering Education, West Lafayette, IN  47906, United States","Shao, G., Purdue University Libraries and School of Information Studies, West Lafayette, IN  47907, United States; Quintana, J.P., Purdue University School of Engineering Education, West Lafayette, IN  47906, United States; Zakharov, W., Purdue University Libraries and School of Information Studies, West Lafayette, IN  47907, United States; Purzer, S., Purdue University School of Engineering Education, West Lafayette, IN  47906, United States; Kim, E., Purdue University School of Engineering Education, West Lafayette, IN  47906, United States",Article,"Final","",Scopus,2-s2.0-85100143048
"Dill-McFarland K.A., Konig S.G., Mazel F., Oliver D.C., McEwen L.M., Hong K.Y., Hallam S.J.","56344177100;57221341317;6506833110;7202761214;55975117600;57192183226;7004456108;","An integrated, modular approach to data science education in microbiology",2021,"PLoS Computational Biology","17","2","e1008661","","",,2,"10.1371/JOURNAL.PCBI.1008661","https://www.scopus.com/inward/record.uri?eid=2-s2.0-85102096824&doi=10.1371%2fJOURNAL.PCBI.1008661&partnerID=40&md5=97ddaec6fd2ec305b63d897b4baa9aa5","Department of Microbiology and Immunology, University of British Columbia, Vancouver, BC, Canada; Ecoscope, University of British Columbia, Vancouver, BC, Canada; Department of Botany and Biodiversity Centre, University of British Columbia, Vancouver, BC, Canada; School of Health Information Science, Faculty of Human and Social Development, University of Victoria, Victoria, BC, Canada; Graduate Program in Bioinformatics, University of British Columbia, Genome Sciences Centre, Vancouver, BC, Canada; Genome Science and Technology Program, University of British Columbia, Vancouver, BC, Canada; Life Sciences Institute, University of British Columbia, Vancouver, BC, Canada","Dill-McFarland, K.A., Department of Microbiology and Immunology, University of British Columbia, Vancouver, BC, Canada, Ecoscope, University of British Columbia, Vancouver, BC, Canada; Konig, S.G., Department of Microbiology and Immunology, University of British Columbia, Vancouver, BC, Canada, Ecoscope, University of British Columbia, Vancouver, BC, Canada; Mazel, F., Department of Microbiology and Immunology, University of British Columbia, Vancouver, BC, Canada, Ecoscope, University of British Columbia, Vancouver, BC, Canada, Department of Botany and Biodiversity Centre, University of British Columbia, Vancouver, BC, Canada; Oliver, D.C., Department of Microbiology and Immunology, University of British Columbia, Vancouver, BC, Canada; McEwen, L.M., Department of Microbiology and Immunology, University of British Columbia, Vancouver, BC, Canada, Ecoscope, University of British Columbia, Vancouver, BC, Canada, School of Health Information Science, Faculty of Human and Social Development, University of Victoria, Victoria, BC, Canada; Hong, K.Y., Department of Microbiology and Immunology, University of British Columbia, Vancouver, BC, Canada, Ecoscope, University of British Columbia, Vancouver, BC, Canada; Hallam, S.J., Department of Microbiology and Immunology, University of British Columbia, Vancouver, BC, Canada, Ecoscope, University of British Columbia, Vancouver, BC, Canada, Graduate Program in Bioinformatics, University of British Columbia, Genome Sciences Centre, Vancouver, BC, Canada, Genome Science and Technology Program, University of British Columbia, Vancouver, BC, Canada, Life Sciences Institute, University of British Columbia, Vancouver, BC, Canada",Article,"Final","All Open Access, Gold, Green",Scopus,2-s2.0-85102096824
"Yuen K.K.F., Wong A.O.M.","16177053900;57215213697;","Designing an Effective Hackathon via University-Industry Collaboration for Data Science Education",2021,"TALE 2021 - IEEE International Conference on Engineering, Technology and Education, Proceedings",,,,"723","728",,1,"10.1109/TALE52509.2021.9678826","https://www.scopus.com/inward/record.uri?eid=2-s2.0-85125927259&doi=10.1109%2fTALE52509.2021.9678826&partnerID=40&md5=6fb21370aa799412c3e7094cede200e3","The Hong Kong Polytechnic University, Department of Computing, Hong Kong; Singapore University of Social Sciences, School of Business, Singapore, Singapore","Yuen, K.K.F., The Hong Kong Polytechnic University, Department of Computing, Hong Kong; Wong, A.O.M., Singapore University of Social Sciences, School of Business, Singapore, Singapore",Conference Paper,"Final","",Scopus,2-s2.0-85125927259
"Rossi R.","56022947000;","Data Science Education Based on ADDIE Model and the EDISON Framework",2021,"Proceedings - 2021 International Conference on Big Data Engineering and Education, BDEE 2021",,,,"40","45",,,"10.1109/BDEE52938.2021.00013","https://www.scopus.com/inward/record.uri?eid=2-s2.0-85123494908&doi=10.1109%2fBDEE52938.2021.00013&partnerID=40&md5=7ea7016184dbd5e42c173e0dc64fa7e4","University of São Paulo (USP), Department of Computer Engineering (PCS), São Paulo, Brazil","Rossi, R., University of São Paulo (USP), Department of Computer Engineering (PCS), São Paulo, Brazil",Conference Paper,"Final","",Scopus,2-s2.0-85123494908
"Swaid S.I., Suid T.Z.","55314031500;57202830964;","Celebrating Design Thinking in Tech Education: The Data Science Education Case",2021,"Communications in Computer and Information Science","1498 CCIS",,,"66","70",,,"10.1007/978-3-030-90176-9_10","https://www.scopus.com/inward/record.uri?eid=2-s2.0-85119889443&doi=10.1007%2f978-3-030-90176-9_10&partnerID=40&md5=7da00fb87d85ba36effd567e115e73c7","Philander Smith College, Little Rock, AR, United States; Dillards Headquarter, Little Rock, AR, United States","Swaid, S.I., Philander Smith College, Little Rock, AR, United States; Suid, T.Z., Dillards Headquarter, Little Rock, AR, United States",Conference Paper,"Final","",Scopus,2-s2.0-85119889443
"Vance E.A.","16240424600;","Using Team-Based Learning to Teach Data Science",2021,"Journal of Statistics and Data Science Education","29","3",,"277","296",,4,"10.1080/26939169.2021.1971587","https://www.scopus.com/inward/record.uri?eid=2-s2.0-85116342244&doi=10.1080%2f26939169.2021.1971587&partnerID=40&md5=4ad5b58001fae42e217a4a6677475d72","Laboratory for Interdisciplinary Statistical Analysis, Department of Applied Mathematics, University of Colorado Boulder, Boulder, CO, United States","Vance, E.A., Laboratory for Interdisciplinary Statistical Analysis, Department of Applied Mathematics, University of Colorado Boulder, Boulder, CO, United States",Article,"Final","All Open Access, Gold",Scopus,2-s2.0-85116342244
"Mayer D., Russell S., Wilson M.P., Kahn M.G., Wiley L.K.","57221319924;57202535381;57204095248;56775542400;55831993000;","Developing and Deploying a Scalable Computing Platform to Support MOOC Education in Clinical Data Science",2021,"AMIA ... Annual Symposium proceedings. AMIA Symposium","2021",,,"430","437",,,,"https://www.scopus.com/inward/record.uri?eid=2-s2.0-85115266318&partnerID=40&md5=09bee3ad6c6f125b042418b5183fdc28","University of Colorado Anschutz Medical Campus, CO, Aurora, United States","Mayer, D., University of Colorado Anschutz Medical Campus, CO, Aurora, United States; Russell, S., University of Colorado Anschutz Medical Campus, CO, Aurora, United States; Wilson, M.P., University of Colorado Anschutz Medical Campus, CO, Aurora, United States; Kahn, M.G., University of Colorado Anschutz Medical Campus, CO, Aurora, United States; Wiley, L.K., University of Colorado Anschutz Medical Campus, CO, Aurora, United States",Article,"Final","",Scopus,2-s2.0-85115266318
"Lee V.R., Drake J., Cain R., Thayne J.","36020199700;55660305800;57188624665;56560162700;","Remembering What Produced the Data: Individual and Social Reconstruction in the Context of a Quantified Self Elementary Data and Statistics Unit",2021,"Cognition and Instruction","39","4",,"367","408",,9,"10.1080/07370008.2021.1936529","https://www.scopus.com/inward/record.uri?eid=2-s2.0-85110497114&doi=10.1080%2f07370008.2021.1936529&partnerID=40&md5=0c26c6733e423dfbbfdb9caecf99c0c3","Graduate School of Education, Stanford University, Stanford, CA, United States; Institutional Research & Assessment, Brigham Young University–Idaho, Rexburg, ID, United States; Weber State University, Ogden, UT, United States; Department of Psychology, Brigham Young University–Idaho, Rexburg, ID, United States","Lee, V.R., Graduate School of Education, Stanford University, Stanford, CA, United States; Drake, J., Institutional Research & Assessment, Brigham Young University–Idaho, Rexburg, ID, United States; Cain, R., Weber State University, Ogden, UT, United States; Thayne, J., Department of Psychology, Brigham Young University–Idaho, Rexburg, ID, United States",Article,"Final","",Scopus,2-s2.0-85110497114
"Xiao T., Ma Y.","57224725018;57224727847;","A Letter to the Journal of Statistics and Data Science Education — A Call for Review of “OkCupid Data for Introductory Statistics and Data Science Courses” by Albert Y. Kim and Adriana Escobedo-Land",2021,"Journal of Statistics and Data Science Education","29","2",,"214","215",,1,"10.1080/26939169.2021.1930812","https://www.scopus.com/inward/record.uri?eid=2-s2.0-85108239365&doi=10.1080%2f26939169.2021.1930812&partnerID=40&md5=240c7772e922bcef56fcb2355ccb0fe3","Statistical & Data Sciences Department, Northampton, MA, United States","Xiao, T., Statistical & Data Sciences Department, Northampton, MA, United States; Ma, Y., Statistical & Data Sciences Department, Northampton, MA, United States",Letter,"Final","All Open Access, Gold",Scopus,2-s2.0-85108239365
"Horton N.J., Hardin J.S.","7006630050;7202730634;","Integrating Computing in the Statistics and Data Science Curriculum: Creative Structures, Novel Skills and Habits, and Ways to Teach Computational Thinking",2021,"Journal of Statistics and Data Science Education","29","S1",,"S1","S3",,3,"10.1080/10691898.2020.1870416","https://www.scopus.com/inward/record.uri?eid=2-s2.0-85107207425&doi=10.1080%2f10691898.2020.1870416&partnerID=40&md5=ac5542fdf1aed7afcbf4fc94dc5f1de1","Department of Mathematics and Statistics, Amherst College, Amherst, MA, United States; Department of Mathematics and Statistics, Pomona College, Claremont, CA, United States","Horton, N.J., Department of Mathematics and Statistics, Amherst College, Amherst, MA, United States; Hardin, J.S., Department of Mathematics and Statistics, Pomona College, Claremont, CA, United States",Article,"Final","All Open Access, Gold, Green",Scopus,2-s2.0-85107207425
"Donoghue T., Voytek B., Ellis S.E.","57212155758;9332417700;55963526300;","Teaching Creative and Practical Data Science at Scale",2021,"Journal of Statistics and Data Science Education","29","S1",,"S27","S39",,9,"10.1080/10691898.2020.1860725","https://www.scopus.com/inward/record.uri?eid=2-s2.0-85107204579&doi=10.1080%2f10691898.2020.1860725&partnerID=40&md5=da03d3edb163110cfd5078c6dc9fee60","Department of Cognitive Science, University of California, San Diego, La Jolla, CA, United States; Halicioğlu Data Science Institute, University of California, San Diego, La Jolla, CA, United States; Neurosciences Graduate Program, University of California, San Diego, La Jolla, CA, United States","Donoghue, T., Department of Cognitive Science, University of California, San Diego, La Jolla, CA, United States; Voytek, B., Department of Cognitive Science, University of California, San Diego, La Jolla, CA, United States, Halicioğlu Data Science Institute, University of California, San Diego, La Jolla, CA, United States, Neurosciences Graduate Program, University of California, San Diego, La Jolla, CA, United States; Ellis, S.E., Department of Cognitive Science, University of California, San Diego, La Jolla, CA, United States, Halicioğlu Data Science Institute, University of California, San Diego, La Jolla, CA, United States",Article,"Final","All Open Access, Gold",Scopus,2-s2.0-85107204579
"Hardin J., Horton N.J., Nolan D., Lang D.T.","7202730634;7006630050;7103352085;7202377375;","Computing in the Statistics Curricula: A 10-Year Retrospective",2021,"Journal of Statistics and Data Science Education","29","S1",,"S4","S6",,3,"10.1080/10691898.2020.1862609","https://www.scopus.com/inward/record.uri?eid=2-s2.0-85107153262&doi=10.1080%2f10691898.2020.1862609&partnerID=40&md5=fb33feae48ef86e75465fdd77933a64d",,"Hardin, J.; Horton, N.J.; Nolan, D.; Lang, D.T.",Article,"Final","All Open Access, Gold",Scopus,2-s2.0-85107153262
"Li F., Xiao Z., Ng J.T.D., Hu X.","57207732941;57223102825;57201810212;55496358400;","Exploring Interdisciplinary Data Science Education for Undergraduates: Preliminary Results",2021,"Lecture Notes in Computer Science (including subseries Lecture Notes in Artificial Intelligence and Lecture Notes in Bioinformatics)","12645 LNCS",,,"551","561",,,"10.1007/978-3-030-71292-1_43","https://www.scopus.com/inward/record.uri?eid=2-s2.0-85104884299&doi=10.1007%2f978-3-030-71292-1_43&partnerID=40&md5=38dfb5dd76b65a7bc7ee20a55ef5792b","University of Hong Kong, Pokfulam Road, Hong Kong; University of Hong Kong Shenzhen Institute of Research and Innovation, Shenzhen, China","Li, F., University of Hong Kong, Pokfulam Road, Hong Kong; Xiao, Z., University of Hong Kong, Pokfulam Road, Hong Kong; Ng, J.T.D., University of Hong Kong Shenzhen Institute of Research and Innovation, Shenzhen, China; Hu, X., University of Hong Kong Shenzhen Institute of Research and Innovation, Shenzhen, China",Conference Paper,"Final","",Scopus,2-s2.0-85104884299
"Oliver J.C., McNeil T.","7401628635;57223096802;","Undergraduate data science degrees emphasize computer science and statistics but fall short in ethics training and domain-specific context",2021,"PeerJ Computer Science","7",,,"1","15",,1,"10.7717/peerj-cs.441","https://www.scopus.com/inward/record.uri?eid=2-s2.0-85104803598&doi=10.7717%2fpeerj-cs.441&partnerID=40&md5=e90b96195aaec84d78048f572a5ba349","Office of Digital Innovation & Stewardship, University Libraries, University of Arizona, Tucson, AZ, United States; Department of Educational Policy Studies and Practice, University of Arizona, Tucson, AZ, United States","Oliver, J.C., Office of Digital Innovation & Stewardship, University Libraries, University of Arizona, Tucson, AZ, United States; McNeil, T., Office of Digital Innovation & Stewardship, University Libraries, University of Arizona, Tucson, AZ, United States, Department of Educational Policy Studies and Practice, University of Arizona, Tucson, AZ, United States",Article,"Final","All Open Access, Gold, Green",Scopus,2-s2.0-85104803598
"Yamamoto N., Ishida A., Ogitsuka K., Oishi N., Murakami J.","36663973700;55917010000;57222315715;57204217890;7102583372;","Development of online learning material for data science programming using 3d puzzle",2021,"International Journal of Information and Education Technology","11","4",,"154","163",,1,"10.18178/ijiet.2021.11.4.1505","https://www.scopus.com/inward/record.uri?eid=2-s2.0-85102281790&doi=10.18178%2fijiet.2021.11.4.1505&partnerID=40&md5=903728bf227760284e6bdd02d88adbea","Department of Human-Oriented Information Systems Engineering, Kumamoto College, National Institute of Technology, Koshi, Japan; Faculty of Liberal Arts, Kumamoto College, National Institute of Technology, Koshi, Japan; Department of Information, Communication and Electronic Engineering, Kumamoto College, National Institute of Technology, Koshi, Japan","Yamamoto, N., Department of Human-Oriented Information Systems Engineering, Kumamoto College, National Institute of Technology, Koshi, Japan; Ishida, A., Faculty of Liberal Arts, Kumamoto College, National Institute of Technology, Koshi, Japan; Ogitsuka, K., Department of Human-Oriented Information Systems Engineering, Kumamoto College, National Institute of Technology, Koshi, Japan; Oishi, N., Department of Information, Communication and Electronic Engineering, Kumamoto College, National Institute of Technology, Koshi, Japan; Murakami, J., Department of Human-Oriented Information Systems Engineering, Kumamoto College, National Institute of Technology, Koshi, Japan",Article,"Final","All Open Access, Gold",Scopus,2-s2.0-85102281790
"Betz M., Gundlach E., Hillery E., Rickus J., Ward M.D.","57218220988;36247131100;57210572488;6602740716;7403168895;","The next wave: We will all be data scientists",2020,"Statistical Analysis and Data Mining","13","6",,"544","547",,1,"10.1002/sam.11476","https://www.scopus.com/inward/record.uri?eid=2-s2.0-85088373509&doi=10.1002%2fsam.11476&partnerID=40&md5=ddc2d8c60b5a7a4499b11424c4075aa4","The Data Mine, Purdue University, West Lafayette, IN, United States; Research Computing, Purdue University, West Lafayette, IN, United States; Office of the Provost, Purdue University, West Lafayette, IN, United States; Department of Agricultural and Biological Engineering, Purdue University, West Lafayette, IN, United States; Department of Statistics, Purdue University, West Lafayette, IN, United States","Betz, M., The Data Mine, Purdue University, West Lafayette, IN, United States; Gundlach, E., The Data Mine, Purdue University, West Lafayette, IN, United States; Hillery, E., Research Computing, Purdue University, West Lafayette, IN, United States; Rickus, J., Office of the Provost, Purdue University, West Lafayette, IN, United States, Department of Agricultural and Biological Engineering, Purdue University, West Lafayette, IN, United States; Ward, M.D., The Data Mine, Purdue University, West Lafayette, IN, United States, Department of Statistics, Purdue University, West Lafayette, IN, United States",Article,"Final","",Scopus,2-s2.0-85088373509
"Mike K., Hazan T., Hazzan O.","57218096276;12140938900;6603726112;","Equalizing Data Science Curriculum for Computer Science Pupils",2020,"ACM International Conference Proceeding Series",,,,"","",,,"10.1145/3428029.3428045","https://www.scopus.com/inward/record.uri?eid=2-s2.0-85123040085&doi=10.1145%2f3428029.3428045&partnerID=40&md5=05da891b2b7d4a79424a53a23ce142c0","Faculty of Education in Science and Technology, Technion-Israel Institute of Technology, Haifa, Israel; Faculty of Industrial Engineering and Management, Technion-Israel Institute of Technology, Haifa, Israel","Mike, K., Faculty of Education in Science and Technology, Technion-Israel Institute of Technology, Haifa, Israel; Hazan, T., Faculty of Industrial Engineering and Management, Technion-Israel Institute of Technology, Haifa, Israel; Hazzan, O., Faculty of Education in Science and Technology, Technion-Israel Institute of Technology, Haifa, Israel",Conference Paper,"Final","",Scopus,2-s2.0-85123040085
"Virkus S., Garoufallou E.","6507680734;23666959600;","Data science and its relationship to library and information science: a content analysis",2020,"Data Technologies and Applications","54","5",,"643","663",,7,"10.1108/DTA-07-2020-0167","https://www.scopus.com/inward/record.uri?eid=2-s2.0-85092270099&doi=10.1108%2fDTA-07-2020-0167&partnerID=40&md5=a59d20219b76b5eb48655e5ba16e12d6","School of Digital Technologies, Tallinn University, Tallinn, Estonia; Department of Library Science, Archives and Information Systems, School of Social Sciences, International Hellenic University, Thessaloniki, Greece; Deltos Group, Thessaloniki, Greece","Virkus, S., School of Digital Technologies, Tallinn University, Tallinn, Estonia; Garoufallou, E., Department of Library Science, Archives and Information Systems, School of Social Sciences, International Hellenic University, Thessaloniki, Greece, Deltos Group, Thessaloniki, Greece",Article,"Final","",Scopus,2-s2.0-85092270099
"Li J.J., Tong X.","54787887600;54380867100;","Statistical Hypothesis Testing versus Machine Learning Binary Classification: Distinctions and Guidelines",2020,"Patterns","1","7","100115","","",,7,"10.1016/j.patter.2020.100115","https://www.scopus.com/inward/record.uri?eid=2-s2.0-85102966494&doi=10.1016%2fj.patter.2020.100115&partnerID=40&md5=3ff27901899d59216207463e59338632","Department of Statistics, University of California, Los Angeles, CA  90095-1554, United States; Department of Data Sciences and Operations, Marshall School of Business, University of Southern California, Los Angeles, CA  90089, United States","Li, J.J., Department of Statistics, University of California, Los Angeles, CA  90095-1554, United States; Tong, X., Department of Data Sciences and Operations, Marshall School of Business, University of Southern California, Los Angeles, CA  90089, United States",Review,"Final","All Open Access, Gold, Green",Scopus,2-s2.0-85102966494
"Robeva R.S., Jungck J.R., Gross L.J.","7003733293;57153950200;7102833298;","Changing the Nature of Quantitative Biology Education: Data Science as a Driver",2020,"Bulletin of Mathematical Biology","82","10","127","","",,7,"10.1007/s11538-020-00785-0","https://www.scopus.com/inward/record.uri?eid=2-s2.0-85091203719&doi=10.1007%2fs11538-020-00785-0&partnerID=40&md5=3f1b2b0baacba2ca2b587f47a482cf05","Department of Mathematics, Randolph-Macon College, Ashland, VA  23005, United States; Center for Bioinformatics and Computational Biology, DENIN Delaware Environmental Institute, University of Delaware, Newark, DE  19716, United States; Departments of Ecology and Evolutionary Biology and Mathematics, University of Tennessee Knoxville, Knoxville, TN  37996, United States; National Institute for Mathematical and Biological Synthesis, University of Tennessee Knoxville, Knoxville, TN  37996, United States","Robeva, R.S., Department of Mathematics, Randolph-Macon College, Ashland, VA  23005, United States; Jungck, J.R., Center for Bioinformatics and Computational Biology, DENIN Delaware Environmental Institute, University of Delaware, Newark, DE  19716, United States; Gross, L.J., Departments of Ecology and Evolutionary Biology and Mathematics, University of Tennessee Knoxville, Knoxville, TN  37996, United States, National Institute for Mathematical and Biological Synthesis, University of Tennessee Knoxville, Knoxville, TN  37996, United States",Article,"Final","",Scopus,2-s2.0-85091203719
"Ionascu A., Stefaniga S.-A.","57222338026;57205019626;","DS lab notebook: A new tool for data science applications",2020,"Proceedings - 2020 22nd International Symposium on Symbolic and Numeric Algorithms for Scientific Computing, SYNASC 2020",,,"9357078","310","314",,,"10.1109/SYNASC51798.2020.00056","https://www.scopus.com/inward/record.uri?eid=2-s2.0-85102361270&doi=10.1109%2fSYNASC51798.2020.00056&partnerID=40&md5=f4260a80b641e1fa56206acee7cf9e5b","West University of Timisoara, Department of Computer Science, Timisoara, Romania","Ionascu, A., West University of Timisoara, Department of Computer Science, Timisoara, Romania; Stefaniga, S.-A., West University of Timisoara, Department of Computer Science, Timisoara, Romania",Conference Paper,"Final","",Scopus,2-s2.0-85102361270
