Authors,Author(s) ID,Title,Year,Source title,Volume,Issue,Art. No.,Page start,Page end,Page count,Cited by,DOI,Link,Affiliations,Authors with affiliations,Document Type,Publication Stage,Open Access,Source,EID
"Rodolfa K.T., Unanue A.D., Gee M., Ghani R.","57212527477;57212527524;57208619481;8705258900;","An Experience-Centered Approach to Training Effective Data Scientists",2019,"Big Data","7","4",,"249","261",,2,"10.1089/big.2019.0100","https://www.scopus.com/inward/record.uri?eid=2-s2.0-85076981157&doi=10.1089%2fbig.2019.0100&partnerID=40&md5=f6bc751427da5cf95e77130cf7862518","Center for Data Science and Public Policy, Computer Science Department and Harris School of Public Policy, University of Chicago, 4902 Forbes Avenue, Gates Hillman 8023, Chicago, IL  15213, United States; Machine Learning Department, Carnegie Mellon University, Pittsburgh, PA, United States; Department of Mathematics, Instituto Tecnológico Autónomo de México, Mexico City, Mexico; Heinz College of Information Systems and Public Policy, Carnegie Mellon University, Pittsburgh, PA, United States","Rodolfa, K.T., Center for Data Science and Public Policy, Computer Science Department and Harris School of Public Policy, University of Chicago, 4902 Forbes Avenue, Gates Hillman 8023, Chicago, IL  15213, United States, Machine Learning Department, Carnegie Mellon University, Pittsburgh, PA, United States; Unanue, A.D., Center for Data Science and Public Policy, Computer Science Department and Harris School of Public Policy, University of Chicago, 4902 Forbes Avenue, Gates Hillman 8023, Chicago, IL  15213, United States, Department of Mathematics, Instituto Tecnológico Autónomo de México, Mexico City, Mexico; Gee, M., Center for Data Science and Public Policy, Computer Science Department and Harris School of Public Policy, University of Chicago, 4902 Forbes Avenue, Gates Hillman 8023, Chicago, IL  15213, United States; Ghani, R., Center for Data Science and Public Policy, Computer Science Department and Harris School of Public Policy, University of Chicago, 4902 Forbes Avenue, Gates Hillman 8023, Chicago, IL  15213, United States, Machine Learning Department, Carnegie Mellon University, Pittsburgh, PA, United States, Heinz College of Information Systems and Public Policy, Carnegie Mellon University, Pittsburgh, PA, United States",Article,"Final","All Open Access, Green",Scopus,2-s2.0-85076981157
"Theobold A., Hancock S.","56928229000;57209487969;","How environmental science graduate students acquire statistical computing skills",2019,"Statistics Education Research Journal","18","2",,"68","85",,1,,"https://www.scopus.com/inward/record.uri?eid=2-s2.0-85082018919&partnerID=40&md5=3340af78a627e9dcbc5aab4e1e3dc980","Department of Mathematical Sciences, Montana State University, 2-214 Wilson Hall P.O. Box 172400, Bozeman, MT  59717, United States; Montana State University, United States","Theobold, A., Department of Mathematical Sciences, Montana State University, 2-214 Wilson Hall P.O. Box 172400, Bozeman, MT  59717, United States; Hancock, S., Montana State University, United States",Article,"Final","",Scopus,2-s2.0-85082018919
"Virkus S., Garoufallou E.","6507680734;23666959600;","Data science from a library and information science perspective",2019,"Data Technologies and Applications","53","4",,"422","441",,20,"10.1108/DTA-05-2019-0076","https://www.scopus.com/inward/record.uri?eid=2-s2.0-85072114174&doi=10.1108%2fDTA-05-2019-0076&partnerID=40&md5=36bb1a290b7bc0d935f07c99d15c000e","School of Digital Technologies, Tallinn University, Tallinn, Estonia; Department of Library Science and Information Systems, Alexander Technological Educational Institute of Thessaloniki, Thessaloniki, Greece; Deltos Group, Thessaloniki, Greece","Virkus, S., School of Digital Technologies, Tallinn University, Tallinn, Estonia; Garoufallou, E., Department of Library Science and Information Systems, Alexander Technological Educational Institute of Thessaloniki, Thessaloniki, Greece, Deltos Group, Thessaloniki, Greece",Article,"Final","",Scopus,2-s2.0-85072114174
"Haynes M., Groen J., Sturzinger E., Zhu D., Shafer J., McGee T.","57162544000;57204823166;57195132970;57215309561;57225452257;7102504511;","Integrating data science into a general education information technology course: An approach to developing data savvy undergraduates",2019,"SIGITE 2019 - Proceedings of the 20th Annual Conference on Information Technology Education",,,,"183","188",,4,"10.1145/3349266.3351417","https://www.scopus.com/inward/record.uri?eid=2-s2.0-85073594142&doi=10.1145%2f3349266.3351417&partnerID=40&md5=6bcc7bc0ddc838faf930b2978971d9a1","United States Military Academy, West Point, NY, United States","Haynes, M., United States Military Academy, West Point, NY, United States; Groen, J., United States Military Academy, West Point, NY, United States; Sturzinger, E., United States Military Academy, West Point, NY, United States; Zhu, D., United States Military Academy, West Point, NY, United States; Shafer, J., United States Military Academy, West Point, NY, United States; McGee, T., United States Military Academy, West Point, NY, United States",Conference Paper,"Final","",Scopus,2-s2.0-85073594142
"Yu B., Hu X.","7402092787;55496358400;","Toward training and assessing reproducible data analysis in data science education",2019,"Data Intelligence","1","4",,"381","392",,6,"10.1162/dint_a_00053","https://www.scopus.com/inward/record.uri?eid=2-s2.0-85087408658&doi=10.1162%2fdint_a_00053&partnerID=40&md5=a3bf9b215f035e934a176ff463d2a7ba","Syracuse University, Ringgold Standard Institution, 320 Hinds Hall, Syracuse, NY  13244-1100, United States; University of Hong Kong, Ringgold Standard Institution, Room 209, Runme Shaw Building, Hong Kong","Yu, B., Syracuse University, Ringgold Standard Institution, 320 Hinds Hall, Syracuse, NY  13244-1100, United States; Hu, X., University of Hong Kong, Ringgold Standard Institution, Room 209, Runme Shaw Building, Hong Kong",Article,"Final","All Open Access, Gold",Scopus,2-s2.0-85087408658
"Demchenko Y., Wiktorski T., Cuadrado Gallego J., Brewer S.","8904483500;57074181400;8504946900;56082251400;","EDISON data science framework (edsf) extension to address transversal skills required by emerging industry 4.0 Transformation",2019,"Proceedings - IEEE 15th International Conference on eScience, eScience 2019",,,"9041712","553","559",,2,"10.1109/eScience.2019.00076","https://www.scopus.com/inward/record.uri?eid=2-s2.0-85083271359&doi=10.1109%2feScience.2019.00076&partnerID=40&md5=cb78436fd0dfa62ad0094e50be025312","University of Amsterdam, Netherlands; University of Stavanger, Norway; University of Alcala, Spain; University of Southampton, United Kingdom","Demchenko, Y., University of Amsterdam, Netherlands; Wiktorski, T., University of Stavanger, Norway; Cuadrado Gallego, J., University of Alcala, Spain; Brewer, S., University of Southampton, United Kingdom",Conference Paper,"Final","",Scopus,2-s2.0-85083271359
"Romney G.W., Guymon J., Romney M.D., Carlson D.A.","8713076800;57215319118;57511913600;57215325397;","Curriculum for hands-on artificial intelligence cybersecurity",2019,"2019 18th International Conference on Information Technology Based Higher Education and Training, ITHET 2019",,,"8937373","","",,3,"10.1109/ITHET46829.2019.8937373","https://www.scopus.com/inward/record.uri?eid=2-s2.0-85078003033&doi=10.1109%2fITHET46829.2019.8937373&partnerID=40&md5=03e0e5728140e1ea5a37ad21e58eb3c1","Center for Cyberscurity Engineering and Technology, University of San Diego, San Diego, CA  92110, United States; EVisit Inc., Mesa, AZ  85206, United States","Romney, G.W., Center for Cyberscurity Engineering and Technology, University of San Diego, San Diego, CA  92110, United States; Guymon, J., Center for Cyberscurity Engineering and Technology, University of San Diego, San Diego, CA  92110, United States; Romney, M.D., EVisit Inc., Mesa, AZ  85206, United States; Carlson, D.A., Center for Cyberscurity Engineering and Technology, University of San Diego, San Diego, CA  92110, United States",Conference Paper,"Final","",Scopus,2-s2.0-85078003033
"Raj R.K., Parrish A., Impagliazzo J., Romanowski C.J., Ahmed S.A., Bennett C.C., Davis K.C., McGettrick A., Mendes Pereira T.S., Sundin L.","7102994746;57531605700;6701638685;7003743523;57210555649;15764315800;7403210248;57223395790;35097611700;57193589372;","Data science education: Global perspectives and convergence",2019,"Annual Conference on Innovation and Technology in Computer Science Education, ITiCSE",,,,"265","266",,6,"10.1145/3304221.3325533","https://www.scopus.com/inward/record.uri?eid=2-s2.0-85070871528&doi=10.1145%2f3304221.3325533&partnerID=40&md5=4b1fb09dd3b44c8b8c43b670ac40bf4e","Rochester Institute of Technology, United States; Mississippi State University, United States; Hofstra University, United States; American University in Cairo, Egypt; DePaul University, United States; Miami University, United States; Strathclyde University, United Kingdom; Instituto Politécnico de Viana do Castelo, Portugal; University of Glasgow, United Kingdom","Raj, R.K., Rochester Institute of Technology, United States; Parrish, A., Mississippi State University, United States; Impagliazzo, J., Hofstra University, United States; Romanowski, C.J., Rochester Institute of Technology, United States; Ahmed, S.A., American University in Cairo, Egypt; Bennett, C.C., DePaul University, United States; Davis, K.C., Miami University, United States; McGettrick, A., Strathclyde University, United Kingdom; Mendes Pereira, T.S., Instituto Politécnico de Viana do Castelo, Portugal; Sundin, L., University of Glasgow, United Kingdom",Conference Paper,"Final","",Scopus,2-s2.0-85070871528
"Green A., Zhai C.","57210730993;35232046000;","Livedatalab: A cloud-based platform to facilitate hands-on data science education at scale",2019,"Proceedings of the 6th 2019 ACM Conference on Learning at Scale, L@S 2019",,,,"","",,,"10.1145/3330430.3333665","https://www.scopus.com/inward/record.uri?eid=2-s2.0-85120532669&doi=10.1145%2f3330430.3333665&partnerID=40&md5=58af43ff3c20f9391a91d4e5746d93f5","University of Illinois, Urbana-Champaign, United States","Green, A., University of Illinois, Urbana-Champaign, United States; Zhai, C., University of Illinois, Urbana-Champaign, United States",Conference Paper,"Final","All Open Access, Bronze",Scopus,2-s2.0-85120532669
"Cassel L., Hongzhi W.","6701656799;57208861656;","Panel: The Computing in Data Science",2019,"CompEd 2019 - Proceedings of the ACM Conference on Global Computing Education",,,,"192","193",,,"10.1145/3300115.3312508","https://www.scopus.com/inward/record.uri?eid=2-s2.0-85065973704&doi=10.1145%2f3300115.3312508&partnerID=40&md5=d7aa3922e61d3a1e878104a2eb96e658","Computing Sciences, Villanova University, Villanova, PA  19085, United States; Computer Science and Technology, Harbin Institute of Technology, Harbin, Heilongjiang, China","Cassel, L., Computing Sciences, Villanova University, Villanova, PA  19085, United States; Hongzhi, W., Computer Science and Technology, Harbin Institute of Technology, Harbin, Heilongjiang, China",Conference Paper,"Final","",Scopus,2-s2.0-85065973704
"Kross S., Guo P.J.","57191953476;16238467300;","Practitioners teaching data science in industry and academia: Expectations, workflows, and challenges",2019,"Conference on Human Factors in Computing Systems - Proceedings",,,,"","",,29,"10.1145/3290605.3300493","https://www.scopus.com/inward/record.uri?eid=2-s2.0-85067608716&doi=10.1145%2f3290605.3300493&partnerID=40&md5=3fda16c35eaf0465cd67367e2967b410","UC San Diego, San Diego, CA, United States","Kross, S., UC San Diego, San Diego, CA, United States; Guo, P.J., UC San Diego, San Diego, CA, United States",Conference Paper,"Final","All Open Access, Bronze",Scopus,2-s2.0-85067608716
"Hassan I.B., Liu J.","57211156967;15623441100;","Embedding data science into computer science education",2019,"IEEE International Conference on Electro Information Technology","2019-May",,"8833753","367","372",,2,"10.1109/EIT.2019.8833753","https://www.scopus.com/inward/record.uri?eid=2-s2.0-85072845554&doi=10.1109%2fEIT.2019.8833753&partnerID=40&md5=6c5a0258f54457e8cab05f7c31357846","Department of Computer Science and Cybersecurity, Metropolitan State University, 700 East Seventh Street, Saint Paul, MN  55106, United States","Hassan, I.B., Department of Computer Science and Cybersecurity, Metropolitan State University, 700 East Seventh Street, Saint Paul, MN  55106, United States; Liu, J., Department of Computer Science and Cybersecurity, Metropolitan State University, 700 East Seventh Street, Saint Paul, MN  55106, United States",Conference Paper,"Final","",Scopus,2-s2.0-85072845554
"Nelson-Brantley H.V., Jenkins P., Chipps E.","56330430600;57196740866;7801394371;","Turning health systems data into actionable information",2019,"Journal of Nursing Administration","49","4",,"176","178",,1,"10.1097/NNA.0000000000000734","https://www.scopus.com/inward/record.uri?eid=2-s2.0-85063272673&doi=10.1097%2fNNA.0000000000000734&partnerID=40&md5=2f4912f3dfcbd6250cfa7b3e0ce118b5","University of Kansas, School of Nursing, 3901 Rainbow Blvd, Kansas City, KS  66160, United States; University of Colorado, College of Nursing, Aurora, United States; Ohio State University, College of Nursing, United States; Ohio State University Wexner Medical Center, Columbus, United States","Nelson-Brantley, H.V., University of Kansas, School of Nursing, 3901 Rainbow Blvd, Kansas City, KS  66160, United States; Jenkins, P., University of Colorado, College of Nursing, Aurora, United States; Chipps, E., Ohio State University, College of Nursing, United States, Ohio State University Wexner Medical Center, Columbus, United States",Editorial,"Final","",Scopus,2-s2.0-85063272673
"Demchenko Y., Comminiello L., Reali G.","8904483500;57208905564;7005839591;","Designing customisable data science curriculum using ontology for data science competences and body of knowledge",2019,"ACM International Conference Proceeding Series",,,,"124","128",,6,"10.1145/3322134.3322143","https://www.scopus.com/inward/record.uri?eid=2-s2.0-85066070476&doi=10.1145%2f3322134.3322143&partnerID=40&md5=55943a3bc40d63f5c2cc624ae832e3ce","University of Amsterdam, Netherlands; University of Perugia, Italy","Demchenko, Y., University of Amsterdam, Netherlands; Comminiello, L., University of Perugia, Italy; Reali, G., University of Perugia, Italy",Conference Paper,"Final","",Scopus,2-s2.0-85066070476
"Dinov I.D.","6603200380;","Quant data science meets dexterous artistry",2019,"International Journal of Data Science and Analytics","7","2",,"81","86",,4,"10.1007/s41060-018-0138-6","https://www.scopus.com/inward/record.uri?eid=2-s2.0-85088166888&doi=10.1007%2fs41060-018-0138-6&partnerID=40&md5=51a2fc973681dbb770522eda3ab6e41a","Statistics Online Computational Resource, Department of Health Behavior and Biological Sciences, University of Michigan, 426 N. Ingalls Str., Ann Arbor, MI  48109, United States; Department of Computational Medicine and Bioinformatics, University of Michigan, 426 N. Ingalls Str., Ann Arbor, MI  48109, United States; Michigan Institute for Data Science, University of Michigan, 426 N. Ingalls Str., Ann Arbor, MI  48109, United States","Dinov, I.D., Statistics Online Computational Resource, Department of Health Behavior and Biological Sciences, University of Michigan, 426 N. Ingalls Str., Ann Arbor, MI  48109, United States, Department of Computational Medicine and Bioinformatics, University of Michigan, 426 N. Ingalls Str., Ann Arbor, MI  48109, United States, Michigan Institute for Data Science, University of Michigan, 426 N. Ingalls Str., Ann Arbor, MI  48109, United States",Article,"Final","All Open Access, Green",Scopus,2-s2.0-85088166888
"Mikroyannidis A., Domingue J., Bachler M., Quick K.","8258067900;57191243163;12038773900;16231111200;","Smart Blockchain Badges for Data Science Education",2019,"Proceedings - Frontiers in Education Conference, FIE","2018-October",,"8659012","","",,10,"10.1109/FIE.2018.8659012","https://www.scopus.com/inward/record.uri?eid=2-s2.0-85063451598&doi=10.1109%2fFIE.2018.8659012&partnerID=40&md5=d197d3c09b5261cc5be568f3c0b1a1f1","Knowledge Media Institute, Open University, Milton Keynes, United Kingdom","Mikroyannidis, A., Knowledge Media Institute, Open University, Milton Keynes, United Kingdom; Domingue, J., Knowledge Media Institute, Open University, Milton Keynes, United Kingdom; Bachler, M., Knowledge Media Institute, Open University, Milton Keynes, United Kingdom; Quick, K., Knowledge Media Institute, Open University, Milton Keynes, United Kingdom",Conference Paper,"Final","All Open Access, Green",Scopus,2-s2.0-85063451598
"Rao A.R., Desai Y., Mishra K.","6602339804;57507638000;57211781585;","Data science education through education data: An end-to-end perspective",2019,"2019 9th IEEE Integrated STEM Education Conference, ISEC 2019",,,"8881970","300","307",,6,"10.1109/ISECon.2019.8881970","https://www.scopus.com/inward/record.uri?eid=2-s2.0-85074979383&doi=10.1109%2fISECon.2019.8881970&partnerID=40&md5=f2aba86437e7fb269087ab9f0251ff23","School of Computer Science and Engineering, Fairleigh Dickinson University, Teaneck, NJ, United States","Rao, A.R., School of Computer Science and Engineering, Fairleigh Dickinson University, Teaneck, NJ, United States; Desai, Y., School of Computer Science and Engineering, Fairleigh Dickinson University, Teaneck, NJ, United States; Mishra, K., School of Computer Science and Engineering, Fairleigh Dickinson University, Teaneck, NJ, United States",Conference Paper,"Final","",Scopus,2-s2.0-85074979383
"Danyluk A., Cassel L., Leidig P., Servin C.","6505907064;6701656799;6701820291;22635580400;","ACM task force on data science education draft report and opportunity for feedback",2019,"SIGCSE 2019 - Proceedings of the 50th ACM Technical Symposium on Computer Science Education",,,,"496","497",,24,"10.1145/3287324.3287522","https://www.scopus.com/inward/record.uri?eid=2-s2.0-85064404269&doi=10.1145%2f3287324.3287522&partnerID=40&md5=61f912d9262e451ea96064fb1086a88f","Williams College, Williamstown, MA, United States; Villanova University, Villanova, PA, United States; Northeastern University, Boston, MA, United States; Grand Valley State University, Allendale, MI, United States; El Paso Community College, El Paso, TX, United States","Danyluk, A., Williams College, Williamstown, MA, United States, Northeastern University, Boston, MA, United States; Cassel, L., Villanova University, Villanova, PA, United States; Leidig, P., Grand Valley State University, Allendale, MI, United States; Servin, C., El Paso Community College, El Paso, TX, United States",Conference Paper,"Final","",Scopus,2-s2.0-85064404269
"Ambite J.L., Gordon J., Fierro L., Burns G., Mathew J.","55666091900;24734073200;57202464062;7201692392;57216818102;","Linking educational resources on data science",2019,"33rd AAAI Conference on Artificial Intelligence, AAAI 2019, 31st Innovative Applications of Artificial Intelligence Conference, IAAI 2019 and the 9th AAAI Symposium on Educational Advances in Artificial Intelligence, EAAI 2019",,,,"9404","9409",,4,,"https://www.scopus.com/inward/record.uri?eid=2-s2.0-85090805208&partnerID=40&md5=875abce2d99beca590c86f6fcc982a55","USC Information Sciences Institute, 4676 Admiralty Way, Marina del Rey, CA  90292, United States; Department of Computer Science, Vassar College, 124 Raymond Ave, Poughkeepsie, NY  12604, United States","Ambite, J.L., USC Information Sciences Institute, 4676 Admiralty Way, Marina del Rey, CA  90292, United States; Gordon, J., Department of Computer Science, Vassar College, 124 Raymond Ave, Poughkeepsie, NY  12604, United States; Fierro, L., USC Information Sciences Institute, 4676 Admiralty Way, Marina del Rey, CA  90292, United States; Burns, G., USC Information Sciences Institute, 4676 Admiralty Way, Marina del Rey, CA  90292, United States; Mathew, J., USC Information Sciences Institute, 4676 Admiralty Way, Marina del Rey, CA  90292, United States",Conference Paper,"Final","",Scopus,2-s2.0-85090805208
"Oh S., Song I.-Y., Mostafa J., Zhang Y., Wu D.","7404104272;8941541300;6701721684;57200294189;57193749868;","Data science education in the iSchool context",2019,"Proceedings of the Association for Information Science and Technology","56","1",,"558","560",,2,"10.1002/pra2.90","https://www.scopus.com/inward/record.uri?eid=2-s2.0-85076096712&doi=10.1002%2fpra2.90&partnerID=40&md5=ad97fa56dfc9d3811c402c1c42719441","Sungkyunkwan University, Seoul, South Korea; Drexel University, Philadelphia, PA, United States; University of North Carolina at Chapel Hill, Chapel Hill, NC, United States; Kent State University, Kent, OH, United States; Wuhan University, Wuhan, China","Oh, S., Sungkyunkwan University, Seoul, South Korea; Song, I.-Y., Drexel University, Philadelphia, PA, United States; Mostafa, J., University of North Carolina at Chapel Hill, Chapel Hill, NC, United States; Zhang, Y., Kent State University, Kent, OH, United States; Wu, D., Wuhan University, Wuhan, China",Article,"Final","",Scopus,2-s2.0-85076096712
"Hagen L., Andrews J., Federer L., Benoit G.","55681353800;55468863100;55918619800;7201904689;","Data Science Education in Library and Information Science Schools",2019,"Proceedings of the Association for Information Science and Technology","56","1",,"536","537",,,"10.1002/pra2.84","https://www.scopus.com/inward/record.uri?eid=2-s2.0-85075955062&doi=10.1002%2fpra2.84&partnerID=40&md5=d7e006f4f392d7c16fb6ccea0e1405b0","University of South Florida, Tampa, FL, United States; National Library of Medicine, National Institutes of Health, Bethesda, MD, United States; University of California, Berkeley, CA, United States","Hagen, L., University of South Florida, Tampa, FL, United States; Andrews, J., University of South Florida, Tampa, FL, United States; Federer, L., National Library of Medicine, National Institutes of Health, Bethesda, MD, United States; Benoit, G., University of California, Berkeley, CA, United States",Article,"Final","",Scopus,2-s2.0-85075955062
"Wang Y.-Y., Lin C.-S.","57208330722;35220132900;","A survey of data science programs and courses in the iSchools",2019,"Proceedings of the Association for Information Science and Technology","56","1",,"801","802",,2,"10.1002/pra2.184","https://www.scopus.com/inward/record.uri?eid=2-s2.0-85075924766&doi=10.1002%2fpra2.184&partnerID=40&md5=1cf0b87eba76e1f192ba5de73e9e1cd6","Dept. of Library and Information Science, National Taiwan University, Taipei, Taiwan","Wang, Y.-Y., Dept. of Library and Information Science, National Taiwan University, Taipei, Taiwan; Lin, C.-S., Dept. of Library and Information Science, National Taiwan University, Taipei, Taiwan",Article,"Final","",Scopus,2-s2.0-85075924766
"Anderson T.D., Parker N.","57210378246;7101900916;","Keeping the human in the data scientist: Shaping human-centered data science education",2019,"Proceedings of the Association for Information Science and Technology","56","1",,"601","603",,3,"10.1002/pra2.103","https://www.scopus.com/inward/record.uri?eid=2-s2.0-85075910251&doi=10.1002%2fpra2.103&partnerID=40&md5=2e484c0013d00b8c82b8438bad920dc3","University of Technology Sydney (UTS), Sydney, Australia","Anderson, T.D., University of Technology Sydney (UTS), Sydney, Australia; Parker, N., University of Technology Sydney (UTS), Sydney, Australia",Article,"Final","",Scopus,2-s2.0-85075910251
"Jiang S., Kahn J.B.","57191191820;56734077300;","Data wrangling practices and process in modeling family migration narratives with big data visualization technologies",2019,"Computer-Supported Collaborative Learning Conference, CSCL","1",,,"208","215",,8,,"https://www.scopus.com/inward/record.uri?eid=2-s2.0-85073350469&partnerID=40&md5=f61f1a050269ba4fb3cd50b42f04a8e5","Carnegie Mellon University, United States; University of Miami, United States","Jiang, S., Carnegie Mellon University, United States; Kahn, J.B., University of Miami, United States",Conference Paper,"Final","",Scopus,2-s2.0-85073350469
"Maksimenkova O., Neznanov A., Radchenko I.","57191339634;55329014600;56724746000;","Using data expedition as a formative assessment tool in data science education: Reasoning, justification, and evaluation",2019,"International Journal of Emerging Technologies in Learning","14","11",,"107","122",,,"10.3991/IJET.V14I11.10202","https://www.scopus.com/inward/record.uri?eid=2-s2.0-85070336982&doi=10.3991%2fIJET.V14I11.10202&partnerID=40&md5=2295ea69fe2b94c7854706f782c7abd5","International Laboratory for Intelligent Systems and Structural Analysis, Faculty of Computer Science, NRU HSE, Moscow, Russian Federation; ITMO University, St.Petersburg, Russian Federation","Maksimenkova, O., International Laboratory for Intelligent Systems and Structural Analysis, Faculty of Computer Science, NRU HSE, Moscow, Russian Federation; Neznanov, A., International Laboratory for Intelligent Systems and Structural Analysis, Faculty of Computer Science, NRU HSE, Moscow, Russian Federation; Radchenko, I., ITMO University, St.Petersburg, Russian Federation",Article,"Final","All Open Access, Gold",Scopus,2-s2.0-85070336982
"Mbwilo B., Kimaro H., Justo G.","57170741100;15022844900;57203299096;","Data Science Postgraduate Education at University of Dar es Salaam in Tanzania: Current Demands and Opportunities",2019,"IFIP Advances in Information and Communication Technology","552",,,"349","360",,2,"10.1007/978-3-030-19115-3_29","https://www.scopus.com/inward/record.uri?eid=2-s2.0-85065719936&doi=10.1007%2f978-3-030-19115-3_29&partnerID=40&md5=7b204ad6156cb5e13bb4b939ee681499","University of Dar es Salaam, Dar es Salaam, Tanzania","Mbwilo, B., University of Dar es Salaam, Dar es Salaam, Tanzania; Kimaro, H., University of Dar es Salaam, Dar es Salaam, Tanzania; Justo, G., University of Dar es Salaam, Dar es Salaam, Tanzania",Conference Paper,"Final","All Open Access, Green",Scopus,2-s2.0-85065719936
