Authors,Author(s) ID,Title,Year,Source title,Volume,Issue,Art. No.,Page start,Page end,Page count,Cited by,DOI,Link,Affiliations,Authors with affiliations,Document Type,Publication Stage,Open Access,Source,EID
"Zheng Y., Liu A., Zheng S.","55713135200;57918586800;57918187000;","Pressure Test: Finding Appropriate Data Size for Practice in Data Science Education",2022,"SIGITE 2022 - Proceedings of the 23rd Annual Conference on Information Technology Education",,,,"142","149",,,"10.1145/3537674.3554748","https://www.scopus.com/inward/record.uri?eid=2-s2.0-85139395982&doi=10.1145%2f3537674.3554748&partnerID=40&md5=bed0e7cac2f4310a675baf0ad2dcd297","College of Computing, Illinois Institute of Technology, United States","Zheng, Y., College of Computing, Illinois Institute of Technology, United States; Liu, A., College of Computing, Illinois Institute of Technology, United States; Zheng, S., College of Computing, Illinois Institute of Technology, United States",Conference Paper,"Final","All Open Access, Bronze",Scopus,2-s2.0-85139395982
"Jiang S., Lee V.R., Rosenberg J.M.","57789043700;36020199700;56735393600;","Data science education across the disciplines: Underexamined opportunities for K-12 innovation",2022,"British Journal of Educational Technology","53","5",,"1073","1079",,,"10.1111/bjet.13258","https://www.scopus.com/inward/record.uri?eid=2-s2.0-85133661613&doi=10.1111%2fbjet.13258&partnerID=40&md5=979999a0ecdd84ef8e9812b3cbbd2a03","Department of Teacher Education and Learning Sciences, North Carolina State University, Raleigh, NC, United States; Graduate School of Education, Stanford University, Stanford, CA, United States; Department of Theory and Practice in Teacher Education, University of Tennessee, Knoxville, Knoxville, TN, United States","Jiang, S., Department of Teacher Education and Learning Sciences, North Carolina State University, Raleigh, NC, United States; Lee, V.R., Graduate School of Education, Stanford University, Stanford, CA, United States; Rosenberg, J.M., Department of Theory and Practice in Teacher Education, University of Tennessee, Knoxville, Knoxville, TN, United States",Editorial,"Final","",Scopus,2-s2.0-85133661613
"Lee V.R., Pimentel D.R., Bhargava R., D'Ignazio C.","36020199700;57216618480;57171684200;57193484649;","Taking data feminism to school: A synthesis and review of pre-collegiate data science education projects",2022,"British Journal of Educational Technology","53","5",,"1096","1113",,1,"10.1111/bjet.13251","https://www.scopus.com/inward/record.uri?eid=2-s2.0-85132591629&doi=10.1111%2fbjet.13251&partnerID=40&md5=84629ea2fc24c7706dd61f3ac73dcb2b","Graduate School of Education, Stanford University, Stanford, CA, United States; Journalism and Art + Design, Northeastern University, Boston, MA, United States; Department of Urban Studies and Planning, Massachusetts Institute of Technology, Cambridge, MA, United States","Lee, V.R., Graduate School of Education, Stanford University, Stanford, CA, United States; Pimentel, D.R., Graduate School of Education, Stanford University, Stanford, CA, United States; Bhargava, R., Journalism and Art + Design, Northeastern University, Boston, MA, United States; D'Ignazio, C., Department of Urban Studies and Planning, Massachusetts Institute of Technology, Cambridge, MA, United States",Review,"Final","",Scopus,2-s2.0-85132591629
"Dvir M., Ben-Zvi D.","57203992168;24448178900;","Students' actual purposes when engaging with a computerized simulation in the context of citizen science",2022,"British Journal of Educational Technology","53","5",,"1202","1220",,1,"10.1111/bjet.13238","https://www.scopus.com/inward/record.uri?eid=2-s2.0-85131384847&doi=10.1111%2fbjet.13238&partnerID=40&md5=c68b204f85cb2d9fcb9a958eeb50ccb6","Faculty of Education in Science and Technology, Technion Israel Institute of Technology, Haifa, Israel; Faculty of Education, University of Haifa, Haifa, Israel","Dvir, M., Faculty of Education in Science and Technology, Technion Israel Institute of Technology, Haifa, Israel; Ben-Zvi, D., Faculty of Education, University of Haifa, Haifa, Israel",Article,"Final","All Open Access, Hybrid Gold",Scopus,2-s2.0-85131384847
"Banadaki Y.","56198153000;","Enabling Data Science Education in STEM Disciplines through Supervised Undergraduate Research Experiences",2022,"ASEE Annual Conference and Exposition, Conference Proceedings",,,,"","",,,,"https://www.scopus.com/inward/record.uri?eid=2-s2.0-85138273525&partnerID=40&md5=4bcc15cec803e71371d05123abe0108f","Department of Computer Science, Southern University, Baton Rouge, LA  70813, United States","Banadaki, Y., Department of Computer Science, Southern University, Baton Rouge, LA  70813, United States",Conference Paper,"Final","",Scopus,2-s2.0-85138273525
"Fisler K.","8576867000;","Data-Centricity: Rethinking Introductory Computing to Support Data Science",2022,"Proceedings of the 1st ACM SIGMOD International Workshop on Data Systems Education: Bridging Education Practice with Education Research, DataEd 2022",,,,"1","3",,,"10.1145/3531072.3535317","https://www.scopus.com/inward/record.uri?eid=2-s2.0-85133190863&doi=10.1145%2f3531072.3535317&partnerID=40&md5=db9314094dca0181f5f8e1a6c580a5ac","Computer Science, Brown University, Providence, RI, United States","Fisler, K., Computer Science, Brown University, Providence, RI, United States",Conference Paper,"Final","",Scopus,2-s2.0-85133190863
"Perach S., Alexandron G.","57748640700;8945106100;","A Blended-Learning Program for Implementing a Rigorous Machine-Learning Curriculum in High-Schools",2022,"L@S 2022 - Proceedings of the 9th ACM Conference on Learning @ Scale",,,,"267","270",,,"10.1145/3491140.3528291","https://www.scopus.com/inward/record.uri?eid=2-s2.0-85132135027&doi=10.1145%2f3491140.3528291&partnerID=40&md5=a88b2a4e8602505cba273fb5961ecc12","Weizmann Institute of Science, Rehovot, Israel","Perach, S., Weizmann Institute of Science, Rehovot, Israel; Alexandron, G., Weizmann Institute of Science, Rehovot, Israel",Conference Paper,"Final","",Scopus,2-s2.0-85132135027
"Kochmar E., Vu D.D., Belfer R., Gupta V., Serban I.V., Pineau J.","55968764300;57201895847;57218281459;57217777745;57191256019;13404973100;","Automated Data-Driven Generation of Personalized Pedagogical Interventions in Intelligent Tutoring Systems",2022,"International Journal of Artificial Intelligence in Education","32","2",,"323","349",,3,"10.1007/s40593-021-00267-x","https://www.scopus.com/inward/record.uri?eid=2-s2.0-85111353737&doi=10.1007%2fs40593-021-00267-x&partnerID=40&md5=01f462e30c850059dad85ddea6492f3a","Korbit Technologies Inc.QC, Canada; University of Bath, Bath, United Kingdom; École de Technologie SupérieureQC, Canada; McGill University & MILA (Quebec Artificial Intelligence Institute)QC, Canada","Kochmar, E., Korbit Technologies Inc.QC, Canada, University of Bath, Bath, United Kingdom; Vu, D.D., Korbit Technologies Inc.QC, Canada, École de Technologie SupérieureQC, Canada; Belfer, R., Korbit Technologies Inc.QC, Canada; Gupta, V., Korbit Technologies Inc.QC, Canada; Serban, I.V., Korbit Technologies Inc.QC, Canada; Pineau, J., Korbit Technologies Inc.QC, Canada, McGill University & MILA (Quebec Artificial Intelligence Institute)QC, Canada",Article,"Final","All Open Access, Hybrid Gold",Scopus,2-s2.0-85111353737
[No author name available],[No author id available],"SIGCSE 2022 - Proceedings of the 53rd ACM Technical Symposium on Computer Science Education V. 2",2022,"SIGCSE 2022 - Proceedings of the 53rd ACM Technical Symposium on Computer Science Education V.2",,,,"","",1231,,,"https://www.scopus.com/inward/record.uri?eid=2-s2.0-85127440084&partnerID=40&md5=ad9a3a9f949bca693231a9b92a0c95e5",,"",Conference Review,"Final","",Scopus,2-s2.0-85127440084
"Doudesis D., Manataki A.","57216457927;34771688700;","Data science in undergraduate medicine: Course overview and student perspectives",2022,"International Journal of Medical Informatics","159",,"104668","","",,,"10.1016/j.ijmedinf.2021.104668","https://www.scopus.com/inward/record.uri?eid=2-s2.0-85122708664&doi=10.1016%2fj.ijmedinf.2021.104668&partnerID=40&md5=5fd34462aeb6230a7d6d52af2d2f9fee","BHF Centre for Cardiovascular Science, University of Edinburgh, Edinburgh, United Kingdom; Usher Institute, University of Edinburgh, Edinburgh, United Kingdom; School of Computer Science, University of St Andrews, St Andrews, United Kingdom","Doudesis, D., BHF Centre for Cardiovascular Science, University of Edinburgh, Edinburgh, United Kingdom, Usher Institute, University of Edinburgh, Edinburgh, United Kingdom; Manataki, A., School of Computer Science, University of St Andrews, St Andrews, United Kingdom",Article,"Final","",Scopus,2-s2.0-85122708664
"Krakowski A., Greenwald E., Roman N.","55397821000;56115685800;57222495984;","""that's What Science Is, All This Data:"" Coding Data Visualizations in Middle School Science Classrooms",2022,"SIGCSE 2022 - Proceedings of the 53rd ACM Technical Symposium on Computer Science Education","1",,,"36","42",,,"10.1145/3478431.3499387","https://www.scopus.com/inward/record.uri?eid=2-s2.0-85126081801&doi=10.1145%2f3478431.3499387&partnerID=40&md5=6fe01640dd2793c9abed0a4f9d909c9d","Lawrence Hall of Science, University of California, Berkeley, CA, United States","Krakowski, A., Lawrence Hall of Science, University of California, Berkeley, CA, United States; Greenwald, E., Lawrence Hall of Science, University of California, Berkeley, CA, United States; Roman, N., Lawrence Hall of Science, University of California, Berkeley, CA, United States",Conference Paper,"Final","All Open Access, Bronze",Scopus,2-s2.0-85126081801
"Bonnell J., Ogihara M., Yesha Y.","57529558500;54420747900;7004127331;","Challenges and Issues in Data Science Education",2022,"Computer","55","2",,"63","66",,,"10.1109/MC.2021.3128734","https://www.scopus.com/inward/record.uri?eid=2-s2.0-85125480282&doi=10.1109%2fMC.2021.3128734&partnerID=40&md5=95a2aeea77d348b1cc8a5bc49e2fb4a0","University of Miami, Coral Gables, FL  33146, United States","Bonnell, J., University of Miami, Coral Gables, FL  33146, United States; Ogihara, M., University of Miami, Coral Gables, FL  33146, United States; Yesha, Y., University of Miami, Coral Gables, FL  33146, United States",Article,"Final","All Open Access, Bronze",Scopus,2-s2.0-85125480282
"Lee V.R., Delaney V.","36020199700;57222254667;","Identifying the Content, Lesson Structure, and Data Use Within Pre-collegiate Data Science Curricula",2022,"Journal of Science Education and Technology","31","1",,"81","98",,2,"10.1007/s10956-021-09932-1","https://www.scopus.com/inward/record.uri?eid=2-s2.0-85115612438&doi=10.1007%2fs10956-021-09932-1&partnerID=40&md5=7194384fc2dd49f7db1ab6ec9e3baec0","Graduate School of Education, Stanford University, 485 Lasuen Mall, Stanford, CA  94305, United States","Lee, V.R., Graduate School of Education, Stanford University, 485 Lasuen Mall, Stanford, CA  94305, United States; Delaney, V., Graduate School of Education, Stanford University, 485 Lasuen Mall, Stanford, CA  94305, United States",Article,"Final","",Scopus,2-s2.0-85115612438
"Susawa Y., Murai K., Kawada K.","57874586900;57222170734;7103087238;","A Study of Basic Education of Data Science using Robot Learning Material in Junior High School Technology Education [中学校技術科におけるロボット教材を用いたデータサイエンスの基礎的素養教育の一考察]",2022,"IEEJ Transactions on Electronics, Information and Systems","142","3",,"291","298",,,"10.1541/ieejeiss.142.291","https://www.scopus.com/inward/record.uri?eid=2-s2.0-85137261295&doi=10.1541%2fieejeiss.142.291&partnerID=40&md5=b77879f726bd80f70f08fbce21fb079f","School of Education, Hiroshima University, 1-1-1, Kagamiyama, Hiroshima, Higashi-hiroshima, 739-8524, Japan; Graduate School of Humanities and Social Sciences, Hiroshima University, 1-1-1, Kagamiyama, Hiroshima, Higashi-hiroshima, 739-8524, Japan","Susawa, Y., School of Education, Hiroshima University, 1-1-1, Kagamiyama, Hiroshima, Higashi-hiroshima, 739-8524, Japan; Murai, K., Graduate School of Humanities and Social Sciences, Hiroshima University, 1-1-1, Kagamiyama, Hiroshima, Higashi-hiroshima, 739-8524, Japan; Kawada, K., Graduate School of Humanities and Social Sciences, Hiroshima University, 1-1-1, Kagamiyama, Hiroshima, Higashi-hiroshima, 739-8524, Japan",Article,"Final","",Scopus,2-s2.0-85137261295
"Sinha T., Malhotra S.","56597622800;57845058700;","Embodied Agents to Scaffold Data Science Education",2022,"Lecture Notes in Computer Science (including subseries Lecture Notes in Artificial Intelligence and Lecture Notes in Bioinformatics)","13356 LNCS",,,"150","155",,,"10.1007/978-3-031-11647-6_26","https://www.scopus.com/inward/record.uri?eid=2-s2.0-85135953712&doi=10.1007%2f978-3-031-11647-6_26&partnerID=40&md5=c7445d71b96ca5045735ffc1653e4159","Professorship for Learning Sciences and Higher Education, ETH Zürich, Zürich, Switzerland; Department of Electrical Engineering, Indian Institute of Technology Kanpur, Kanpur, India","Sinha, T., Professorship for Learning Sciences and Higher Education, ETH Zürich, Zürich, Switzerland; Malhotra, S., Department of Electrical Engineering, Indian Institute of Technology Kanpur, Kanpur, India",Conference Paper,"Final","",Scopus,2-s2.0-85135953712
"Zakaria M.S.","56553799200;","Data science education programmes in Middle Eastern institutions: A survey study",2022,"IFLA Journal",,,,"","",,,"10.1177/03400352221113362","https://www.scopus.com/inward/record.uri?eid=2-s2.0-85135498894&doi=10.1177%2f03400352221113362&partnerID=40&md5=082595b1174c4b2d3bdf6ee8d370f622","Department of Library and Information Science, Ain Shams University, Egypt","Zakaria, M.S., Department of Library and Information Science, Ain Shams University, Egypt",Article,"Article in Press","",Scopus,2-s2.0-85135498894
"Pieterman-Bos A., van Mil M.H.W.","57223373556;36061330900;","Integration of Philosophy of Science in Biomedical Data Science Education to Foster Better Scientific Practice",2022,"Science and Education",,,,"","",,,"10.1007/s11191-022-00363-x","https://www.scopus.com/inward/record.uri?eid=2-s2.0-85135136431&doi=10.1007%2fs11191-022-00363-x&partnerID=40&md5=565831dccec5aabcb9aae3256fd123f0","Center of Education and Training, University Medical Center Utrecht, Utrecht University, Utrecht, Netherlands; Center for Molecular Medicine, University Center Utrecht, Utrecht University, Utrecht, Netherlands","Pieterman-Bos, A., Center of Education and Training, University Medical Center Utrecht, Utrecht University, Utrecht, Netherlands; van Mil, M.H.W., Center of Education and Training, University Medical Center Utrecht, Utrecht University, Utrecht, Netherlands, Center for Molecular Medicine, University Center Utrecht, Utrecht University, Utrecht, Netherlands",Article,"Article in Press","All Open Access, Hybrid Gold",Scopus,2-s2.0-85135136431
"Bilgin A.A.B., Powell A., Richards D.","24780425600;57820999100;57193711592;","WORK INTEGRATED LEARNING IN DATA SCIENCE AND A PROPOSED ASSESSMENT FRAMEWORK",2022,"Statistics Education Research Journal","21","2","12","","",,,"10.52041/SERJ.V21I2.26","https://www.scopus.com/inward/record.uri?eid=2-s2.0-85135030284&doi=10.52041%2fSERJ.V21I2.26&partnerID=40&md5=8e1ccaf6d73488268626fd163411615e","Macquarie University, Australia","Bilgin, A.A.B., Macquarie University, Australia; Powell, A., Macquarie University, Australia; Richards, D., Macquarie University, Australia",Article,"Final","All Open Access, Bronze",Scopus,2-s2.0-85135030284
"Mike K., Hazzan O.","57218096276;6603726112;","MACHINE LEARNING FOR NON-MAJOR DATA SCIENCE STUDENTS: A WHITE BOX APPROACH",2022,"Statistics Education Research Journal","21","2","10","","",,,"10.52041/serj.v21i2.45","https://www.scopus.com/inward/record.uri?eid=2-s2.0-85134686548&doi=10.52041%2fserj.v21i2.45&partnerID=40&md5=9efbc4e5e795532e6f910ca1b3482483","Technion – Israel Institute of Technology, Israel","Mike, K., Technion – Israel Institute of Technology, Israel; Hazzan, O., Technion – Israel Institute of Technology, Israel",Article,"Final","All Open Access, Bronze",Scopus,2-s2.0-85134686548
"Vance E.A., Glimp D.R., Pieplow N.D., Garrity J.M., Melbourne B.A.","16240424600;26033891500;35956768300;52963535800;6602884718;","INTEGRATING THE HUMANITIES INTO DATA SCIENCE EDUCATION: REIMAGINING THE INTRODUCTORY DATA SCIENCE COURSE",2022,"Statistics Education Research Journal","21","2","9","","",,,"10.52041/serj.v21i2.42","https://www.scopus.com/inward/record.uri?eid=2-s2.0-85134639665&doi=10.52041%2fserj.v21i2.42&partnerID=40&md5=5d6c37a776714e9d03119408cc9e5e59","University of Colorado, Boulder, United States","Vance, E.A., University of Colorado, Boulder, United States; Glimp, D.R., University of Colorado, Boulder, United States; Pieplow, N.D., University of Colorado, Boulder, United States; Garrity, J.M., University of Colorado, Boulder, United States; Melbourne, B.A., University of Colorado, Boulder, United States",Article,"Final","All Open Access, Bronze",Scopus,2-s2.0-85134639665
"Heinzman E.","57812615700;","“I LOVE MATH ONLY IF IT’S CODING”: A CASE STUDY OF STUDENT EXPERIENCES IN THE INTRODUCTION TO DATA SCIENCE COURSE",2022,"Statistics Education Research Journal","21","2","5","","",,,"10.52041/serj.v21i2.43","https://www.scopus.com/inward/record.uri?eid=2-s2.0-85134595644&doi=10.52041%2fserj.v21i2.43&partnerID=40&md5=c447658dc71a53dcfa3e3a535e15f653","University of California, San Diego, United States","Heinzman, E., University of California, San Diego, United States",Article,"Final","All Open Access, Bronze",Scopus,2-s2.0-85134595644
"Podworny S., Hüsing S., Schulte C., Podworny S.","57198424072;57351644600;16239813600;57198424072;","A PLACE FOR A DATA SCIENCE INTRODUCTION IN SCHOOL: BETWEEN STATISTICS AND PROGRAMMING",2022,"Statistics Education Research Journal","21","2","6","","",,,"10.52041/serj.v21i2.46","https://www.scopus.com/inward/record.uri?eid=2-s2.0-85134591557&doi=10.52041%2fserj.v21i2.46&partnerID=40&md5=7ee138455636a59e5b5f3236feb63b61","Paderborn University, Germany; Warburger Str. 100, Paderborn, 33098, Germany","Podworny, S., Paderborn University, Germany, Warburger Str. 100, Paderborn, 33098, Germany; Hüsing, S., Paderborn University, Germany; Schulte, C., Paderborn University, Germany; Podworny, S., Paderborn University, Germany, Warburger Str. 100, Paderborn, 33098, Germany",Article,"Final","All Open Access, Bronze",Scopus,2-s2.0-85134591557
"Lee H.S., Mojica G.F., Thrasher E.P., Baumgartner P.","9278983300;36634637200;57812225600;7006155115;","INVESTIGATING DATA LIKE A DATA SCIENTIST: KEY PRACTICES AND PROCESSES",2022,"Statistics Education Research Journal","21","2","3","","",,,"10.52041/serj.v21i2.41","https://www.scopus.com/inward/record.uri?eid=2-s2.0-85134568312&doi=10.52041%2fserj.v21i2.41&partnerID=40&md5=c4774abdd06d13f541dd5d48b0710dbc","North Carolina State University, United States; Explosion AI, United States","Lee, H.S., North Carolina State University, United States; Mojica, G.F., North Carolina State University, United States; Thrasher, E.P., North Carolina State University, United States; Baumgartner, P., Explosion AI, United States",Article,"Final","All Open Access, Bronze",Scopus,2-s2.0-85134568312
"Biehler R., De Veaux R., Engel J., Kazak S., Frischemeier D.","6505830190;6603138510;57212887247;56000069200;57198421458;","EDITORIAL: RESEARCH ON DATA SCIENCE EDUCATION SPECIAL ISSUE OF THE STATISTICS EDUCATION RESEARCH JOURNAL",2022,"Statistics Education Research Journal","21","2","1","","",,,"10.52041/serj.v21i2.606","https://www.scopus.com/inward/record.uri?eid=2-s2.0-85134564836&doi=10.52041%2fserj.v21i2.606&partnerID=40&md5=8e1725d389e031eed85faac8479c9608","Paderborn University, Germany; Williams College, United States; University of Education Ludwigsburg, Germany; Pamukkale University, Turkey; University of Münster, Germany","Biehler, R., Paderborn University, Germany; De Veaux, R., Williams College, United States; Engel, J., University of Education Ludwigsburg, Germany; Kazak, S., Pamukkale University, Turkey; Frischemeier, D., University of Münster, Germany",Editorial,"Final","All Open Access, Bronze",Scopus,2-s2.0-85134564836
"De Veaux R., Hoerl R., Snee R., Velleman P.","6603138510;6701358117;7003339406;6603122932;","TOWARD HOLISTIC DATA SCIENCE EDUCATION",2022,"Statistics Education Research Journal","21","2","2","","",,,"10.52041/serj.v21i2.40","https://www.scopus.com/inward/record.uri?eid=2-s2.0-85134564812&doi=10.52041%2fserj.v21i2.40&partnerID=40&md5=f347c99233ca18a95ae4c9ee60de3d4c","Williams College, United States; Union College, United States; Snee Associates, LLC, United States; Cornell University, United States","De Veaux, R., Williams College, United States; Hoerl, R., Union College, United States; Snee, R., Snee Associates, LLC, United States; Velleman, P., Cornell University, United States",Article,"Final","All Open Access, Bronze",Scopus,2-s2.0-85134564812
"Fergusson A., Pfannkuch M.","57220043335;6506077095;","INTRODUCING HIGH SCHOOL STATISTICS TEACHERS TO PREDICTIVE MODELLING AND APIs USING CODE-DRIVEN TOOLS",2022,"Statistics Education Research Journal","21","2","8","","",,,"10.52041/serj.v21i2.49","https://www.scopus.com/inward/record.uri?eid=2-s2.0-85134563794&doi=10.52041%2fserj.v21i2.49&partnerID=40&md5=dc0c86de203854196c01284d73807b61","University of Auckland, New Zealand","Fergusson, A., University of Auckland, New Zealand; Pfannkuch, M., University of Auckland, New Zealand",Article,"Final","All Open Access, Bronze",Scopus,2-s2.0-85134563794
"Tucker M.C., Shaw S.T., Son J.Y., Stigler J.W.","57223640232;57201526171;57803575900;6603878605;","Teaching Statistics and Data Analysis with R",2022,"Journal of Statistics and Data Science Education",,,,"","",,,"10.1080/26939169.2022.2089410","https://www.scopus.com/inward/record.uri?eid=2-s2.0-85134266228&doi=10.1080%2f26939169.2022.2089410&partnerID=40&md5=8ac2e3c27d4927537e99d89c866dc31b","University of California, Los Angeles, Los Angeles, CA, United States; Worcester Polytechnic Institutute, Worcester, MA, United States; California State University, Los Angeles, Los Angeles, CA, United States","Tucker, M.C., University of California, Los Angeles, Los Angeles, CA, United States; Shaw, S.T., Worcester Polytechnic Institutute, Worcester, MA, United States; Son, J.Y., California State University, Los Angeles, Los Angeles, CA, United States; Stigler, J.W., University of California, Los Angeles, Los Angeles, CA, United States",Article,"Article in Press","All Open Access, Gold",Scopus,2-s2.0-85134266228
"Horton N.J.","7006630050;","What to Teach, How to Teach, and When to Teach: Musings on Data Science Education",2022,"Journal of Statistics and Data Science Education","30","2",,"99","",,,"10.1080/26939169.2022.2097563","https://www.scopus.com/inward/record.uri?eid=2-s2.0-85134261321&doi=10.1080%2f26939169.2022.2097563&partnerID=40&md5=7e01ef3cdb56725fb847de40c26fedd1",,"Horton, N.J.",Editorial,"Final","All Open Access, Gold",Scopus,2-s2.0-85134261321
"Rangaswamy N., Narasimhan H.","24473533400;15520205400;","The Power of Data Science Ontogeny: Thick Data Studies on the Indian IT Skill Tutoring Microcosm",2022,"Transforming Communication",,,,"75","96",,,"10.1007/978-3-030-96180-0_4","https://www.scopus.com/inward/record.uri?eid=2-s2.0-85130793127&doi=10.1007%2f978-3-030-96180-0_4&partnerID=40&md5=f1ffb909992545506016f6eb8355dcf2","Kohli Centre on Intelligent Systems, International Institute of Information Technology, IIIT, Hyderabad, India; Department of Social Anthropology and Sociology, The International Institute of Technology, Hyderabad, India","Rangaswamy, N., Kohli Centre on Intelligent Systems, International Institute of Information Technology, IIIT, Hyderabad, India; Narasimhan, H., Department of Social Anthropology and Sociology, The International Institute of Technology, Hyderabad, India",Book Chapter,"Final","All Open Access, Hybrid Gold",Scopus,2-s2.0-85130793127
"Chung W., Zhang X., Ahmad Z., Sayadi H., Rafatirad S.","57701154100;57701427600;57701695100;56281774600;14034730300;","Machine Learning to the Rescue: ML-Assisted Framework for Equity-Driven Education",2022,"IEEE Global Engineering Education Conference, EDUCON","2022-March",,,"1254","1263",,,"10.1109/EDUCON52537.2022.9766530","https://www.scopus.com/inward/record.uri?eid=2-s2.0-85130418653&doi=10.1109%2fEDUCON52537.2022.9766530&partnerID=40&md5=daa6dc40a231a1409075f6b3bcf38b32","Uc Davis, Davis, United States; Csu Long Beach, Long Beach, United States","Chung, W., Uc Davis, Davis, United States; Zhang, X., Uc Davis, Davis, United States; Ahmad, Z., Uc Davis, Davis, United States; Sayadi, H., Csu Long Beach, Long Beach, United States; Rafatirad, S., Uc Davis, Davis, United States",Conference Paper,"Final","",Scopus,2-s2.0-85130418653
"Dalton M., Groth R.E.","56288020600;8611187700;","Reflections on the Current and Potential K-12 Impact of the Journal of Statistics and Data Science Education",2022,"Journal of Statistics and Data Science Education","30","2",,"179","186",,,"10.1080/26939169.2022.2054881","https://www.scopus.com/inward/record.uri?eid=2-s2.0-85129381499&doi=10.1080%2f26939169.2022.2054881&partnerID=40&md5=fa51a61353b3819d1e33c26debbe44eb","State College Area High School, State CollegePA, United States; Salisbury University, Salisbury, MD, United States","Dalton, M., State College Area High School, State CollegePA, United States; Groth, R.E., Salisbury University, Salisbury, MD, United States",Article,"Final","All Open Access, Gold",Scopus,2-s2.0-85129381499
