reviewer_1,reviewer_2,our_id,document_title,doi,document_link,authors,publication_year,abstract,database,open_access,new_doc_type,journal,conference,book,affiliation_country,content_area,research_question,data_collection_type,main_field,big_pic_notes,interesting_facts,keywords,keep,why_not_keep
5,4,Demchenko_2020_edison_data,edison data science framework (edsf) extension to address transversal skills required by emerging industry 4.0 transformation,10.1109/escience.2019.00076,https://doi.org/10.1109/escience.2019.00076,Y. Demchenko; T. Wiktorski; J. Cuadrado Gallego; S. Brewer,2020,"The emerging data-driven economy (also defined as Industry 4.0 or simply 4IR), encompassing industry, research and business, requires new types of specialists that are able to support all stages of the data lifecycle from data production and input, to data processing and actionable results delivery, visualisation and reporting, which can be collectively defined as the Data Science family of professions. Data Science as a research and academic discipline provides a basis for Data Analytics and ML/AI applications. The education and training of the data related professions must reflect all multi-disciplinary knowledge and competences that are required from the Data Science and handling practitioners in modern, data-driven research and the digital economy. In the modern era, with ever faster technology changes, matched by strong skills demand, the Data Science education and training programme should be customizable and deliverable in multiple forms, tailored for different categories of professional roles and profiles. Referring to other publications by the authors on building customizable and interoperable Data Science curricula for different types of learners and target application domains, this paper is focused on defining a set of transversal competences and skills that are required from modern and future Data Science professions. These include workplace and professional skills that cover critical thinking, problem solving, and creativity required to work in highly automated and dynamic environment. The proposed approach is based on the EDISON Data Science Framework (EDSF) initially developed within the EU funded Project EDISON and currently being further developed in the EU funded MATES project and also the FAIRsFAIR projects.",IEEE,NA,conference paper,NA,2019 15th International Conference on eScience (eScience),NA,"Netherlands, Norway, Spain, United Kingdom",program example,FALSE,no data,not mentioned?,They are providing guidelines for DS programs.,NA,"Data Scientist Professional, Big Data, Industry 4.0, EDISON Data Science Framework (EDSF), Data Science Competences Framework, Data Science professional skills, FAIR principles, Data Management and Stewardship",TRUE,NA
2,5,Howe_2017_data_science,"data science education: we're missing the boat, again",10.1109/icde.2017.215,https://doi.org/10.1109/icde.2017.215,B. Howe; M. Franklin; L. Haas; T. Kraska; J. Ullman,2017,"In the first wave of data science education programs, data engineering topics (systems, scalable algorithms, data management, integration) tended to be de-emphasized in favor of machine learning and statistical modeling. The anecdotal evidence suggests this was a mistake: data scientists report spending most of their time grappling with data far upstream of modeling activities. A second wave of data science education is emerging, one with increased emphasis on practical issues in ethics, legal compliance, scientific reproducibility, data quality, and algorithmic bias. The data engineering community has a second chance to influence these programs beyond just providing a set of tools. In this panel, we'll discuss the role of data engineering in data science education programs, and how best to capitalize on emerging opportunities in this space.",IEEE,NA,unknown,NA,NA,NA,NA,NA,NA,NA,NA,NA,NA,NA,FALSE,panel
4,5,Zhang_2017_datalab_introducing,datalab: introducing software engineering thinking into data science education at scale,10.1109/icse-seet.2017.7,https://doi.org/10.1109/icse-seet.2017.7,Y. Zhang; T. Zhang; Y. Jia; J. Sun; F. Xu; W. Xu,2017,"Data science education is a new area in computer science that has attracted increasing attention in recent years. However, currently, data science educators lack good tools and methodologies. In particular, they lack integrated tools through which their students can acquire hands-on software engineering experience. To address these problems, we designed and implemented DataLab, a web-based tool for data science education that integrates code, data and execution management into one system. The goal of DataLab is to provide a hands-on online lab environment to train students to have basic software engineering thinking and habits while maintaining a focus on the core data science contents. In this paper, we present the user-experience design and system-level implementation of DataLab. Further, we evaluate DataLab's performance through an in-classroom use case. Finally, using objective log-based learning behavior analysis and a subjective survey, we demonstrate DataLab's effectiveness.",IEEE,NA,unknown,NA,NA,NA,NA,NA,NA,NA,NA,NA,NA,NA,FALSE,graduate
5,1,Ionascu_2021_ds_lab,ds lab notebook: a new tool for data science applications,10.1109/synasc51798.2020.00056,https://doi.org/10.1109/synasc51798.2020.00056,A. Ionascu; S. -A. Stefaniga,2020,"The main focus of the technical application of this research relies on a web and mobile-based solution identified as Data Science Notebook named as DS Lab Notebook. Specifically, the main focus will be on tackling already present challenges in data science education and a solution presented around DS Lab, an interactive computational notebook. The core ideas are represented by the concept of extending the traditional computing notebooks, especially from the Jupyter family, with live visualizations, debugging, widgets, and interactivity during the educational process across all the major platforms: web, Android, and IOS. The features are outlined in several use cases that can be useful in the data-science teaching process, with a primary focus in matrix manipulations, scatter plots, and image filters. Python 3 was used as the main programming runtime and the back-end for providing access to variable values and type information is being described in the form of a runtime-independent pipeline relying on code parsing and injection.",IEEE,NA,conference paper,NA,2020 22nd International Symposium on Symbolic and Numeric Algorithms for Scientific Computing (SYNASC),NA,"Romania, Romania",education technology,FALSE,no data,computer science,They are developing a notebook environment that can be used in DS classes.,NA,"Data Science,  Jupyter, Real-Time, Interactive systems and tools, Human computer interaction, Development frameworks and environments",TRUE,NA
3,5,Song_2016_big_data,big data and data science: what should we teach?,10.1111/exsy.12130,https://doi.org/10.1111/exsy.12130,"Song I., Zhu Y.",2016,"The era of big data has arrived. Big data bring us the data-driven paradigm and enlighten us to challenge new classes of problems we were not able to solve in the past. We are beginning to see the impacts of big data in every aspect of our lives and society. We need a science that can address these big data problems. Data science is a new emerging discipline that was termed to address challenges that we are facing and going to face in the big data era. Thus, education in data science is the key to success, and we need concrete strategies and approaches to better educate future data scientists. In this paper, we discuss general concepts on big data, data science, and data scientists and show the results of an extensive survey on current data science education in United States. Finally, we propose various approaches that data science education should aim to accomplish.",Scopus,NA,article,Journal of Data and Information Science,NA,NA,"United States of America, United States of America",program example,FALSE,no data,informatics,They provide a framework for data science education in iSchools.,NA,unspecified,TRUE,NA
5,3,Erickson_2021_introducing_data,introducing data science with data moves and codap,10.1111/test.12240,https://doi.org/10.1111/test.12240,"Erickson T., Chen E.",2021,This paper describes a short module [3] for introducing data science to senior school students or other data-science beginners. The design focuses on ‚Äúdata moves.‚Äù Students use CODAP [5] to do their work.,Scopus,NA,article,NA,NA,NA,NA,NA,NA,NA,NA,NA,NA,NA,FALSE,K-12
5,2,Anderson_2014_data_science,data science as an undergraduate degree,10.1145/2538862.2538868,https://doi.org/10.1145/2538862.2538868,"Anderson P., McGuffee J., Uminsky D.",2014,NA,Scopus,NA,conference paper,NA,NA,NA,NA,NA,NA,NA,NA,NA,NA,NA,FALSE,panel
1,5,Anslow_2016_datathons,datathons: an experience report of data hackathons for data science education,10.1145/2839509.2844568,https://doi.org/10.1145/2839509.2844568,"Anslow C., Brosz J., Maurer F., Boyes M.",2016,Large amounts of data are becoming increasingly available through open data repositories as well as companies and governments collecting data to improve decision making and efficiencies. Consequently there is a need to increase the data literacy of computer science students. Data science is a relatively new area within computer science and the curriculum is rapidly evolving along with the tools required to perform analytics which students need to learn how to effectively use. To address the needs of students learning key data science and analytics skills we propose augmenting existing data science curriculums with hackathon events that focus on data also known as datathons. In this paper we present our experience at hosting and running four datathons that involved students and members from the community coming together to solve challenging problems with data from not-for-profit social good organizations and publicly open data. Our reported experience from our datathons will help inform other academics and community groups who also wish to host datathons to help facilitate their students and members to learn key data science and analytics skills.,Scopus,NA,conference paper,NA,SIGCSE '16: Proceedings of the 47th ACM Technical Symposium on Computing Science Education,NA,"United Kingdom, Canada, Canada, Canada",extra curricular activity example,FALSE,no data,computer science,They provide case studies based on running datathons.,NA,"analytics, community engagement, datathon, data science, hackathon, open data",TRUE,NA
5,4,Demchenko_2019_designing_customisable,designing customisable data science curriculum using ontology for data science competences and body of knowledge,10.1145/3322134.3322143,https://doi.org/10.1145/3322134.3322143,"Demchenko Y., Comminiello L., Reali G.",2019,"Importance of Data Science education and training is growing with the emergence of data driven technologies and organisational culture that intend to derive actionable value for improving research process or enterprise business using variety of enterprise data and widely available open and social media data. Modern data driven research and industry require new types of specialists that are capable to support all stages of the data lifecycle from data production and input to data processing and actionable results delivery, visualisation and reporting, which can be jointly defined as the Data Science professions family. The education and training of Data Scientists requires multi-disciplinary approach combining wide view of the Data Science and Analytics foundation with deep practical knowledge in domain specific areas. In modern conditions with the fast technology change and strong skills demand, the Data Science education and training should be customizable and delivered in multiple form, also providing sufficient data labs facilities for practical training. This paper discusses approach to building customizable Data Science curriculum for different types of learners based on using the ontology of the EDISON Data Science Framework (EDSF) developed in the EU funded Project EDISON and widely used by universities and professional training organisations.",Scopus,NA,conference paper,NA,ICBDE'19: Proceedings of the 2019 International Conference on Big Data and Education,NA,"Netherlands, Italy, Italy",program example,FALSE,no data,data science,describing possible uses of the Edison Data Science Framework (EDSF),NA,"Data Science, Data Scientist Professional, Data Science Ontology, Big Data, EDISON Data Science Framework (EDSF), Data Science Competences Framework, Data Science Body of Knowledge, Data Science Model Curriculum",TRUE,NA
2,5,Haynes_2019_integrating_data,integrating data science into a general education information technology course: an approach to developing data savvy undergraduates,10.1145/3349266.3351417,https://doi.org/10.1145/3349266.3351417,"Haynes M., Groen J., Sturzinger E., Zhu D., Shafer J., McGee T.",2019,NA,Scopus,NA,conference paper,NA,SIGITE '19: Proceedings of the 20th Annual SIG Conference on Information Technology Education,NA,"United States of America, United States of America, United States of America, United States of America, United States of America, United States of America, United States of America",call to action,TRUE,mixed,information systems,Offering an introductory data science course may not be possible but introductory data science concepts can be introduced in an introductory information technology class.,NA,"information systems, data mining, social and professional topics, information systems education, information technology education",TRUE,NA
4,5,Nair_2020_metadata,metadata: a tool to supplement data science education for the first year undergraduates,10.1145/3395245.3396409,https://doi.org/10.1145/3395245.3396409,"Nair R., Chugani M.N., Thangavel S.K.",2020,"In the Indian Universities, data science courses are offered to computer science undergraduates only in their higher semesters of under-graduation. Keeping in mind, the growing importance of data science, under-graduates need to be introduced to data science courses in their first year of under-graduation itself. Although first year undergraduates are furnished with the required mathematical and statistical concepts during their higher secondary education, a requirement of understanding sophisticated programming concepts hamstrings universities from offering courses in data science to first year undergraduates. As an outcome of our research, we propose a software named MetaData. MetaData abstracts all levels of implementation and helps students better understand the fundamental concepts in data science by observing the applicability of these concepts on real-world datasets. We justify the effectiveness of the tool through a data science classroom scenario, wherein 44 first year undergraduates were encouraged to use the tool and provide constructive feedback.",Scopus,NA,conference paper,NA,ICIET 2020: Proceedings of the 2020 8th International Conference on Information and Education Technology,NA,"India, India, India",education technology and class activity example,TRUE,quantitative,computer science,Software example to teach introductory concepts,NA,"pedagogy, data science education, user-friendly tool, data science lifecycle",TRUE,NA
5,1,Blair_2021_establishing_abet,establishing abet accreditation criteria for data science,10.1145/3408877.3432445,https://doi.org/10.1145/3408877.3432445,"Blair J.R.S., Jones L., Leidig P., Murray S., Raj R.K., Romanowski C.J.",2021,"Prompted by the skyrocketing demand for data scientists, progress made by the ACM Data Science Task Force on defining data science competencies, and inquiries about data science accreditation, ABET is in the process of developing accreditation criteria for undergraduate data science programs. The effort is led by members of a joint data science criteria subcommittee appointed by ABET's Computing Accreditation Commission (CAC) and CSAB (the lead society for computing accreditation). Establishing data science accreditation criteria is a notable milestone in the maturing data science discipline, indicating the presence of an accepted body of knowledge, standards of practice, and ethical codes for practitioners. This position paper motivates the effort and discusses prior work towards defining data science education requirements. It describes the ongoing process for creating and obtaining approval of the accreditation criteria, and how feedback was and will be solicited from the computing and statistical communities. The current draft data science criteria, which was approved in July 2020 by the relevant ABET bodies for a year of public review and comment, is presented. These criteria emphasize the three pillars of data science: computing foundations, mathematical/statistical foundations, and experience in at least one data application domain. This report thus serves both to inform and to stimulate the academic discussion needed to finalize appropriate data science accreditation by ABET.",Scopus,NA,conference paper,NA,SIGCSE '21: Proceedings of the 52nd ACM Technical Symposium on Computer Science Education,NA,"United States of America, United States of America, United States of America, United States of America, United States of America, United States of America",guidelines,FALSE,no data,data science,The process of how ABET accreditation criteria are decided is explained.,NA,"Data science programs, data analytics programs, computing education, program accreditation",TRUE,NA
3,5,Bhavya_2021_scaling_up,scaling up data science course projects: a case study,10.1145/3430895.3460168,https://doi.org/10.1145/3430895.3460168,"Bhavya B., Xiao J., Zhai C.",2021,NA,Scopus,NA,conference paper,NA,L@S '21: Proceedings of the Eighth ACM Conference on Learning @ Scale,NA,"United States of America, United States of America, United States of America",pedagogical approach,TRUE,mixed,data science,Finding ways to grade projects as assessments in large classes throgh peer-review and TA meta-review.,NA,"scalable assessment, data science education, course projects",TRUE,NA
5,3,Nguyen_2021_exploring_metrics,exploring metrics for the analysis of code submissions in an introductory data science course,10.1145/3448139.3448209,https://doi.org/10.1145/3448139.3448209,"Nguyen H., Lim M., Moore S., Nyberg E., Sakr M., Stamper J.",2021,"While data science education has gained increased recognition in both academic institutions and industry, there has been a lack of research on automated coding assessment for novice students. Our work presents a first step in this direction, by leveraging the coding metrics from traditional software engineering (Halstead Volume and Cyclomatic Complexity) in combination with those that reflect a data science projectís learning objectives (number of library calls and number of common library calls with the solution code). Through these metrics, we examined the code submissions of 97 students across two semesters of an introductory data science course. Our results indicated that the metrics can identify cases where students had overly complicated codes and would benefit from scaffolding feedback. The number of library calls, in particular, was also a significant predictor of changes in submission score and submission runtime, which highlights the distinctive nature of data science programming. We conclude with suggestions for extending our analyses towards more actionable intervention strategies, for example by tracking the fine-grained submission grading outputs throughout a studentís submission history, to better model and support them in their data science learning process.",Scopus,"All Open Access, Bronze",conference paper,NA,AK21: LAK21: 11th International Learning Analytics and Knowledge Conference,NA,"United States of America, United States of America, United States of America, United States of America, United States of America, United States of America",???,TRUE,NA,NA,NA,NA,NA,FALSE,graduate
5,2,Zheng_2022_pressure_test,pressure test: finding appropriate data size for practice in data science education,10.1145/3537674.3554748,https://doi.org/10.1145/3537674.3554748,"Zheng Y., Liu A., Zheng S.",2022,NA,Scopus,"All Open Access, Bronze",conference paper,NA,SIGITE '22: Proceedings of the 23rd Annual Conference on Information Technology Education,NA,"United States of America, United States of America, United States of America",???,TRUE,quant,data science,They are trying to find what is the appropriate dataset size for data science education. They first ask students how much time they don't mind for spending processing the code on different assignments. Then they use students' preferred time length to figure out the size of the data that can be utilized for a given model (e.g. k means).,NA,"data science, scalability, data size, experimental analysis, running efficiency, information technology education",TRUE,NA
1,5,Yu_2019_toward_training,toward training and assessing reproducible data analysis in data science education,10.1162/dint_a_00053,https://doi.org/10.1162/dint_a_00053,"Yu B., Hu X.",2019,NA,Scopus,"All Open Access, Gold",article,Data Intelligence,NA,NA,"United States, China",NA,NA,NA,NA,NA,NA,NA,FALSE,graduate
5,4,Bilgin_2022_work_integrated,work integrated learning in data science and a proposed assessment framework,10.52041/serj.v21i2.26,https://doi.org/10.52041/serj.v21i2.26,"Bilgin A.A.B., Powell A., Richards D.",2022,"Work integrated learning (WIL) has been the norm in disciplines such as medicine, teacher education and engineering; however, it has not been implemented until recently in statistics and not for every student in computer science education. There seems to be no literature on the use of WIL for data science education. With the changed focus of universities to making graduates ìjob readyî, university-industry collaboration widened to encompass learning and teaching. Undoubtedly authentic problems coming from industry created opportunities for students to practice their future profession before graduation. This shift in the curriculum, however, brought its challenges both for the students and their lecturers. In this paper, we present a case study and propose an assessment framework for data science WIL.",Scopus,"All Open Access, Bronze",article,Statistics Education Research Journal,NA,NA,"Australia, Australia, Australia",course example,FALSE,no data,computer science,They propose an assessment framework for data science work integrated learning.,NA,"Statistics education research, Data science education, Work integrated learning, Authentic problem-based learning, Assessment framework",TRUE,NA
2,5,Oliver_2021_undergraduate_data,undergraduate data science degrees emphasize computer science and statistics but fall short in ethics training and domain-specific context,10.7717/peerj-cs.441,https://doi.org/10.7717/peerj-cs.441,"Oliver JC, McNeil T.",2021,"The interdisciplinary field of data science, which applies techniques from computer science and statistics to address questions across domains, has enjoyed recent considerable growth and interest. This emergence also extends to undergraduate education, whereby a growing number of institutions now offer degree programs in data science. However, there is considerable variation in what the field actually entails and, by extension, differences in how undergraduate programs prepare students for data-intensive careers. We used two seminal frameworks for data science education to evaluate undergraduate data science programs at a subset of 4-year institutions in the United States; developing and applying a rubric, we assessed how well each program met the guidelines of each of the frameworks. Most programs scored high in statistics and computer science and low in domain-specific education, ethics, and areas of communication. Moreover, the academic unit administering the degree program significantly influenced the course-load distribution of computer science and statistics/mathematics courses. We conclude that current data science undergraduate programs provide solid grounding in computational and statistical approaches, yet may not deliver sufficient context in terms of domain knowledge and ethical considerations necessary for appropriate data science applications. Additional refinement of the expectations for undergraduate data science education is warranted.",pubmed,NA,article, PeerJ Computer Science,NA,NA,"United States of America, United States of America",???,TRUE,mixed,data science,"They are comparing different data science programs across different universities and examining the course coverage while comparing it to NASEM framework. They conclude ""current data science
undergraduate programs provide solid grounding in computational and statistical
approaches, yet may not deliver sufficient context in terms of domain knowledge and
ethical considerations necessary for appropriate data science applications.""","In contrast, areas/sub-areas
focusing on reproducibility and ethics in data science were generally not covered in
undergraduate curricula. Reproducibility, including design of workflows and reproducible
analyses, was rarely indicated in course descriptions","Education, Machine learning, Ethics, Statistics, Computer science, Curricula,
Data science",TRUE,NA
