our_id,document_title,doi,document_link,authors,abstract,database,reviewer_1,reviewer_2,keep,why_not_keep,prelim_review,open_access,first_published,new_doc_type,journal,conference,book,source,affiliation_country,content_area,research_question,data_collection_type,audience_discipline,reason_audience_discipline,observational_unit,department,reason_department,source_discipline,reason_source_discipline,big_pic_notes,interesting_facts,keywords
Vance_2022_integrating,integrating the humanities into data science education: reimagining the introductory data science course,10.52041/serj.v21i2.42,https://doi.org/10.52041/serj.v21i2.42,"Vance E.A., Glimp D.R., Pieplow N.D., Garrity J.M., Melbourne B.A.","Despite growing calls to develop data science studentsí ethical awareness and expand human-centered approaches to data science education, introductory courses in the field remain largely technical. A new interdisciplinary data science program aims to merge STEM and humanities perspectives starting at the very beginning of the data science curriculum. Existing literature suggests that humanities integration can make STEM courses more appealing to a wider range of students, including women and students of color, and enhance student learning of essential concepts and foundational reasoning skills, such as those collectively known as data acumen. Cultivating studentsí data acumen requires a more inclusive vision of how the knowledge and insights generated through computational methods and statistical analysis relates to other ways of knowing.",Scopus,1,3,TRUE,NA,FALSE,TRUE,2022,journal article,Statistics Education Research Journal,NA,NA,Statistics Education Research Journal,"United States of America, United States of America, United States of America, United States of America, United States of America",course example,TRUE,no data,broad,"They talk about bringing humanities into data science, not the other way around",not applicable,multiple departments,"""Was developed by an interdisciplinary team of faculty and students from the humanities and sciences, working with educational specialists in CU Boulderís Arts and Sciences Teaching with Technology (ASSETT) group""",statistics education,"""SERJ aims to advance research-based knowledge that can help to improve the teaching, learning, and understanding of statistics or probability at all educational levels and in both formal (classroom-based) and informal (out-of-classroom) contexts."" https://iase-web.org/Publications.php?p=SERJ",Describes introductory data science course for all students grounded in humanities and data science education research.,"This course can sitisfy General Education Arts and Humanities divisional distribution requirement or the Quantitative Reasoning skills requirement in the College of Arts and
Sciences at CU Boulder.","data acumen, data literacy, data science education research, humanities education research, statistical literacy, statistics education research"
Virkus_2019_data_science,data science from a library and information science perspective,10.1108/dta-05-2019-0076,https://doi.org/10.1108/dta-05-2019-0076,"Virkus S., Garoufallou E.","Purpose
Data science is a relatively new field which has gained considerable attention in recent years. This new field requires a wide range of knowledge and skills from different disciplines including mathematics and statistics, computer science and information science. The purpose of this paper is to present the results of the study that explored the field of data science from the library and information science (LIS) perspective.

Design/methodology/approach
Analysis of research publications on data science was made on the basis of papers published in the Web of Science database. The following research questions were proposed: What are the main tendencies in publication years, document types, countries of origin, source titles, authors of publications, affiliations of the article authors and the most cited articles related to data science in the field of LIS? What are the main themes discussed in the publications from the LIS perspective?

Findings
The highest contribution to data science comes from the computer science research community. The contribution of information science and library science community is quite small. However, there has been continuous increase in articles from the year 2015. The main document types are journal articles, followed by conference proceedings and editorial material. The top three journals that publish data science papers from the LIS perspective are the Journal of the American Medical Informatics Association, the International Journal of Information Management and the Journal of the Association for Information Science and Technology. The top five countries publishing are USA, China, England, Australia and India. The most cited article has got 112 citations. The analysis revealed that the data science field is quite interdisciplinary by nature. In addition to the field of LIS the papers belonged to several other research areas. The reviewed articles belonged to the six broad categories: data science education and training; knowledge and skills of the data professional; the role of libraries and librarians in the data science movement; tools, techniques and applications of data science; data science from the knowledge management perspective; and data science from the perspective of health sciences.

Research limitations/implications
The limitations of this research are that this study only analyzed research papers in the Web of Science database and therefore only covers a certain amount of scientific papers published in the field of LIS. In addition, only publications with the term ìdata scienceî in the topic area of the Web of Science database were analyzed. Therefore, several relevant studies are not discussed in this paper that are not reflected in the Web of Science database or were related to other keywords such as ìe-science,î ìe-research,î ìdata service,î ìdata curationî or ìresearch data management.î

Originality/value
The field of data science has not been explored using bibliographic analysis of publications from the perspective of the LIS. This paper helps to better understand the field of data science and the perspectives for information professionals.",Scopus,3,5,FALSE,literature review not related to education just on data science,FALSE,NA,NA,NA,NA,NA,NA,NA,NA,NA,NA,NA,NA,NA,NA,NA,NA,NA,NA,NA,NA,NA
Virkus_2020_data_science,data science and its relationship to library and information science: a content analysis,10.1108/dta-07-2020-0167,https://doi.org/10.1108/dta-07-2020-0167,"Virkus S., Garoufallou E.","Purpose
The purpose of this paper is to present the results of a study exploring the emerging field of data science from the library and information science (LIS) perspective.

Design/methodology/approach
Content analysis of research publications on data science was made of papers published in the Web of Science database to identify the main themes discussed in the publications from the LIS perspective.

Findings
A content analysis of 80 publications is presented. The articles belonged to the six broad categories: data science education and training; knowledge and skills of the data professional; the role of libraries and librarians in the data science movement; tools, techniques and applications of data science; data science from the knowledge management perspective; and data science from the perspective of health sciences. The category of tools, techniques and applications of data science was most addressed by the authors, followed by data science from the perspective of health sciences, data science education and training and knowledge and skills of the data professional. However, several publications fell into several categories because these topics were closely related.

Research limitations/implications
Only publication recorded in the Web of Science database and with the term ìdata scienceî in the topic area were analyzed. Therefore, several relevant studies are not discussed in this paper that either were related to other keywords such as ìe-scienceî, ìe-researchî, ìdata serviceî, ìdata curationî, ìresearch data managementî or ìscientific data managementî or were not present in the Web of Science database.

Originality/value
The paper provides the first exploration by content analysis of the field of data science from the perspective of the LIS.",Scopus,5,3,FALSE,literature review not related to education just on data science,FALSE,NA,NA,NA,NA,NA,NA,NA,NA,NA,NA,NA,NA,NA,NA,NA,NA,NA,NA,NA,NA,NA
Wang_2019_survey,a survey of data science programs and courses in the ischools,10.1002/pra2.184,https://doi.org/10.1002/pra2.184,"Wang Y.-Y., Lin C.-S.","In this poster, we examined the current data science programs and courses in the 102 iSchools members. The result shows that the program distribution was unequal by region, and the courses offered by iSchools concentrated on data analysis skills. Research data management, which concerns data management throughout research life cycle and data curation, constituted less than 10% of the courses.",Scopus,4,2,FALSE,poster,FALSE,NA,NA,NA,NA,NA,NA,NA,NA,NA,NA,NA,NA,NA,NA,NA,NA,NA,NA,NA,NA,NA
Wiktorski_2017_quantitative,quantitative and qualitative analysis of current data science programs from perspective of data science competence groups and framework,10.1109/cloudcom.2016.0109,https://doi.org/10.1109/cloudcom.2016.0109,T. Wiktorski; Y. Demchenko; A. Belloum; A. Shirazi,"Data Science is becoming a field connecting multi-year development in areas such as Big Data and Data Analytics, and also applied domains like Bioengineering. Data Science education programs are rapidly being created on all levels. Usually it happens through reuse or renaming and can result in curricula that lack proper balance of competences, which balance is necessary for future data scientists. Our quantitative analysis of over 300 programs worldwide shows that at least one of the three core data science competence groups is under-represented in the majority of programs. Moreover, general business courses are often suggested to students to cover the domain competence group, which in most cases results in superficial treatment of this competence group. Our further qualitative analysis demonstrates that learning outcomes for most of the courses are usually not defined or defined improperly.",IEEE,1,5,TRUE,NA,FALSE,TRUE,2017,conference article,NA,2016 IEEE 8th International Conference on Cloud Computing Technology and Science (CloudCom),NA,2016 IEEE 8th International Conference on Cloud Computing Technology and Science (CloudCom),"Norway, Netherlands, Netherlands, Norway",review of current state of data science education,TRUE,mixed,broad,"They are talking about all data science programs, not subsetting to specific type/field",Acadmic and inductrial data science programs and courses,not applicable,Due to content area,computer science,""" CloudCom is the premier conference on Cloud Computing worldwide, attracting researchers, developers, users, students and practitioners from the fields of big data, systems architecture, services research, virtualization, security and privacy, high performance computing, always with an emphasis on how to build cloud computing platforms with real impact."" https://2016cloudcom.ux.uis.no/",Analysis of 300 data science programs worldwide with reference to the EDISON Data Science Competence Framework,"1. Most programs are imbalanced (applied statistics vs. data engineering vs. domain knowledge 2. Hard to pinpoint program objectives in terms of Bloom's taxonomy 3. There are comparisons of European vs. non-European programs. 4. ""while Computer Science departments are the main driver behind Data Science programs in Europe, outside Europe it is Business and Management departments""","business, computer science, computers, data science, europe, sociology"
Wilkerson_2020_situating_data,situating data science: exploring how relationships to data shape learning,10.1080/10508406.2019.1705664,https://doi.org/10.1080/10508406.2019.1705664,"Wilkerson, Michelle Hoda;Polman, Joseph L.","The emerging field of Data Science has had a large impact on science and society. This has led to over a decade of calls to establish a corresponding field of Data Science Education. There is still a need, however, to more deeply conceptualize what a field of Data Science Education might entail in terms of scope, responsibility, and execution. This special issue explores how one distinguishing feature of Data Science--its focus on data collected from social and environmental contexts within which learners often find themselves deeply embedded--suggests serious implications for learning and education. The learning sciences is uniquely positioned to investigate how such contextual embeddings impact learners' engagement with data including conceptual, experiential, communal, racialized, spatial, and political dimensions. This special issue demonstrates the richly layered relationships learners build with data and reveals them to be not merely utilitarian mechanisms for learning about data, but a critical part of navigating data as social text and understanding Data Science as a discipline. Together, the contributions offer a vision of how the learning sciences can contribute to a more expansive, agentive and socially aware Data Science Education.",ERIC,2,4,FALSE,introduction to a journal's special issue,FALSE,NA,NA,NA,NA,NA,NA,NA,NA,NA,NA,NA,NA,NA,NA,NA,NA,NA,NA,NA,NA,NA
Witmer_2021_inclusivity,inclusivity in statistics and data science education,10.1080/26939169.2021.1906555,https://doi.org/10.1080/26939169.2021.1906555,"Witmer, J",NULL,web of science,2,5,FALSE,note from journal's editor,FALSE,NA,NA,NA,NA,NA,NA,NA,NA,NA,NA,NA,NA,NA,NA,NA,NA,NA,NA,NA,NA,NA
Xiao_2021_letter,a letter to the journal of statistics and data science education ‚Äî a call for review of ‚Äúokcupid data for introductory statistics and data science courses‚Äù by albert y. kim and adriana escobedo-land,10.1080/26939169.2021.1930812,https://doi.org/10.1080/26939169.2021.1930812,"Xiao T., Ma Y.",NULL,Scopus,2,4,FALSE,letter to journal editor,FALSE,NA,NA,NA,NA,NA,NA,NA,NA,NA,NA,NA,NA,NA,NA,NA,NA,NA,NA,NA,NA,NA
Yamamoto_2021_development,development of online learning material for data science programming using 3d puzzle,10.18178/ijiet.2021.11.4.1505,https://doi.org/10.18178/ijiet.2021.11.4.1505,"Yamamoto N., Ishida A., Ogitsuka K., Oishi N., Murakami J.","In multidimensional data processing, one of the important data structures is a higher-order tensor or a multidimensional array. In general, the processing related to the higher-order tensor is so complicated that we have been developing understanding support tools for it using 3D puzzles from the viewpoint of making students interested. However, although these tools have been tried by students in graduation studies and other some occasions, their introduction into lectures was one issue. Therefore, in this study, we developed a new programming exercise material for the higher-order tensor, which is supposed to be used in data science subjects, by using a 3D puzzle. This learning material is also composed of Microsoft Teams, and students can access the material remotely to learn programming. In this paper, several students actually tried this material. As a result, it was found that the students themselves could create and submit assignment reports by viewing explanatory videos and performing exercises. From this, it is expected that this material will be able to introduce to data science courses, including online use.",Scopus,2,1,TRUE,NA,FALSE,TRUE,2021,journal article,International Journal of Information and Education Technology,NA,NA,International Journal of Information and Education Technology,"Japan, Japan, Japan, Japan, Japan",class activity example,TRUE,quant,broad,"They don't mention any specific field, they say their work is for teaching an advanced topic in data science",students in  information engineering department,information engineering,section 4,information technology; education,"""International Journal of Information and Education Technology (IJIET) is an international academic open access journal which gains a foothold in Singapore, Asia and opens to the world. It aims to promote the integration of information and education technology."" https://www.ijiet.org/","Discussed learning material they developed for teaching high-ordered tensors using a 3D puzzle, with a small case study as support.",NA,"3d puzzle, data science education, higher-order tensor, programing materials, r, remote exercise"
Yu_2019_toward_training,toward training and assessing reproducible data analysis in data science education,10.1162/dint_a_00053,https://doi.org/10.1162/dint_a_00053,"Yu B., Hu X.","Reproducibility is a cornerstone of scientific research. Data science is not an exception. In recent years scientists were concerned about a large number of irreproducible studies. Such reproducibility crisis in science could severely undermine public trust in science and science-based public policy. Recent efforts to promote reproducible research mainly focused on matured scientists and much less on student training. In this study, we conducted action research on students in data science to evaluate to what extent students are ready for communicating reproducible data analysis. The results show that although two-thirds of the students claimed they were able to reproduce results in peer reports, only one-third of reports provided all necessary information for replication. The actual replication results also include conflicting claims; some lacked comparisons of original and replication results, indicating that some students did not share a consistent understanding of what reproducibility means and how to report replication results. The findings suggest that more training is needed to help data science students communicating reproducible data analysis.",Scopus,1,5,FALSE,graduate,FALSE,NA,NA,NA,NA,NA,NA,NA,NA,NA,NA,NA,NA,NA,NA,NA,NA,NA,NA,NA,NA,NA
Yu_2020_experimental_evidence,experimental evidence extraction system in data science with hybrid table features and ensemble learning,10.1145/3366423.3380174,https://doi.org/10.1145/3366423.3380174,"Yu W., Peng W., Shu Y., Zeng Q., Jiang M.","Data Science has been one of the most popular fields in higher education and research activities. It takes tons of time to read the experimental section of thousands of papers and figure out the performance of the data science techniques. In this work, we build an experimental evidence extraction system to automate the integration of tables (in the paper PDFs) into a database of experimental results. First, it crops the tables and recognizes the templates. Second, it classifies the column names and row names into ìmethodî, ìdatasetî, or ìevaluation metricî, and then unified all the table cells into (method, dataset, metric, score)-quadruples. We propose hybrid features including structural and semantic table features as well as an ensemble learning approach for column/row name classification and table unification. SQL statements can be used to answer questions such as whether a method is the state-of-the-art or whether the reported numbers are conflicting.",Scopus,3,5,FALSE,methodology,FALSE,NA,NA,NA,NA,NA,NA,NA,NA,NA,NA,NA,NA,NA,NA,NA,NA,NA,NA,NA,NA,NA
Yuen_2022_designing,designing an effective hackathon via university-industry collaboration for data science education,10.1109/tale52509.2021.9678826,https://doi.org/10.1109/tale52509.2021.9678826,K. K. F. Yuen; A. O. M. Wong,"Hackathons have been used not only by enterprises for technological innovation and digital transformation, but also in academia for education innovation and programme promotion. This paper presents a hybrid approach for transforming an enterprise's workplace problem into a technology vendor-sponsored hackathon education. A real-life case study of a hackathon for college participants who are prospective students of a university data science programme is demonstrated. The university-industry collaborative approach of the hackathon provides several benefits for its stakeholders, namely promoting the reputation and recognition of the university's data science programme; offering creative and innovative solutions to the enterprise's workplace problems; encouraging the adoption of the technology vendor's platform, and finally, enhancing the teaching and learning experience for the college students and lecturers. This paper provides a structured framework and recommends practical principles and guidelines for designing effective hackathons that can bring about mind-set change and real-world business transformation.",IEEE,5,3,FALSE,prospective college students,FALSE,NA,NA,NA,NA,NA,NA,NA,NA,NA,NA,NA,NA,NA,NA,NA,NA,NA,NA,NA,NA,NA
Yun_2020_social_media,the social media macroscope: a science gateway for research using social media data,10.1016/j.future.2019.10.029,https://doi.org/10.1016/j.future.2019.10.029,"Yun JT,Vance N,Wang C,Marini L,Troy J,Donelson C,Chin CL,Henderson MD","In recent years, the explosion of social media platforms and the public collection of social data has brought forth a growing desire and need for research capabilities in the realm of social media and social data analytics. Research on this scale, however, requires a high level of computational and data-science expertise, limiting the researchers who are capable of undertaking social media data-driven research to those with significant computational expertise or those who have access to such experts as part of their research team. The Social Media Macroscope (SMM) is a science gateway with the goal of removing that limitation and making social media data, analytics, and visualization tools accessible to researchers and students of all levels of expertise. The SMM provides a single point of access to a suite of intuitive web interfaces for performing social media data collection, analysis, and visualization via for open-source and commercial tools. Within the SMM social scientists are able to process and store large datasets and collaborate with other researchers by sharing ideas, data, and methods. This document functions as a brief primer on the initial build of the SMM and we end this paper discussing future directions for the SMM.",science direct,1,3,FALSE,k-12,FALSE,NA,NA,NA,NA,NA,NA,NA,NA,NA,NA,NA,NA,NA,NA,NA,NA,NA,NA,NA,NA,NA
Zakaria_2022_data_science,data science education programmes in middle eastern institutions: a survey study,10.1177/03400352221113362,https://doi.org/10.1177/03400352221113362,Zakaria M.S.,"In response to the current trends in dealing with data in academia, various research institutions and commercial entities around the world are building new programmes to fill the gaps in workforce demand in specific disciplines, including data curation, big data, data management, data science and data analytics. Thus, the aim of the present study was to reveal the reality of data science education in the Middle East and to determine the opportunities and challenges for teaching data science in the region. Thirteen countries in the Middle East were offering 48 data science programmes at the time of the study. The results reveal that these data science programmes significantly use the words √É¬¢√¢‚Äö¬¨√ã≈ìdata√É¬¢√¢‚Äö¬¨√¢‚Äû¬¢ and √É¬¢√¢‚Äö¬¨√ã≈ìanalytics√É¬¢√¢‚Äö¬¨√¢‚Äû¬¢ in their names. With regard to the academic affiliations of the data science programmes, the study found that they are offered in a variety of schools, especially computer science, information technology and business. Moreover, the study found that computer science is the dominant trend in the programmes. Data science programmes have a significant overlap with other programmes, especially statistics and computer science, because of the interdisciplinary nature of this field. Data science schools in the Middle East differ in terms of their programme titles, programme descriptions, course catalogues, curriculum structures and course objectives. Broadly, this study may be useful for those who are seeking to establish a data science programme or to strengthen data science curricula at both the undergraduate and postgraduate levels.",Scopus,4,1,TRUE,NA,FALSE,FALSE,2022,journal article,International Federation of Library Associations and Institutions,NA,NA,International Federation of Library Associations and Institutions,Egypt,review of current state of data science education,TRUE,mixed,broad,"The Middle Eastern programs they anlyzed had ""data"" and ""analytics"" in the name, from a variety of fields, not subsetted to any specific field",data science programs offered by Middle Eastern academic institutions,not applicable,due to content area,library science,"""The Federation is an independent, international, non-governmental, not-for-profit organization, which advances the interests of library and information associations, libraries and information services, librarians and the communities they serve throughout the world."" https://www.ifla.org/about-us/",Reviews current state of data science education in the middle east with a survey of 48 institutions.,NA,"arabian gulf countries, curriculum analysis, data analytics, data science, data science education, middle east"
