our_id,document_title,doi,document_link,authors,abstract,database,reviewer_1,reviewer_2,keep,why_not_keep,prelim_review,open_access,first_published,new_doc_type,journal,conference,book,source,affiliation_country,content_area,research_question,data_collection_type,audience_discipline,reason_audience_discipline,observational_unit,department,reason_department,source_discipline,reason_source_discipline,big_pic_notes,interesting_facts,keywords
Perach_2022_blendedlearning_program,a blended-learning program for implementing a rigorous machine-learning curriculum in high-schools,10.1145/3491140.3528291,https://doi.org/10.1145/3491140.3528291,"Perach S., Alexandron G.","AI, and, more specifically, deep learning, is profoundly impacting our industries and societies [1]. In recent years, machine learning (ML) 's surging impact has sparked discourse about the importance of AI education for young people, and in recent years, several initiatives and projects pursuing the mission of K-12 AI education have emerged. In 2020 Israel's Ministry of Education (MoE) approved a new comprehensive and rigorous ML curriculum targeting 11 and 12th-grade pupils majoring in computer science (CS). The curriculum is meant to be taught by the existing CS teacher workforce. However, since ML theory and practice are fundamentally different from traditional CS [2], implementing this thorough ML curriculum poses substantial challenges in developing an effective teaching workforce to deliver it. In this research, we suggest a solution for this challenge in the form of a blended-learning (BL) program. The online component of this program is based mainly on Coursera's Deep Learning Specialization MOOCs series [3]. The BL program, enhanced with pedagogical training, is also used for the professional development (PD) of the teachers who deliver the program. Out of fourteen CS teachers who participated in the PD in the summer of 2021, ten teach the BL program this year to 273 high-school pupils. Initial results demonstrate the achievement of the curriculum learning goals and provide compelling preliminary evidence that this program enables CS teachers who are new to machine learning to teach this thorough curriculum effectively",Scopus,3,4,FALSE,k-12,FALSE,NA,NA,NA,NA,NA,NA,NA,NA,NA,NA,NA,NA,NA,NA,NA,NA,NA,NA,NA,NA,NA
Pieterman_2022_integration,integration of philosophy of science in biomedical data science education to foster better scientific practice,10.1007/s11191-022-00363-x,https://doi.org/10.1007/s11191-022-00363-x,"Pieterman-Bos A., van Mil M.H.W.","Biomedical data science education faces the challenge of preparing students for conducting rigorous research with increasingly complex and large datasets. At the same time, philosophers of science face the challenge of making their expertise accessible for scientists in such a way that it can improve everyday research practice. Here, we investigate the possibility of approaching these challenges together. In current and proposed approaches to biomedical data science education, we identify a dominant focus on only one aspect of conducting scientific research: understanding and using data, research methods, and statistical methods. We argue that this approach cannot solve biomedical data science‚Äôs challenge and we propose to shift the focus to four other aspects of conducting research: making and justifying decisions in research design and implementation, explaining their epistemic and non-epistemic effects, balancing varying responsibilities, and reporting scientific research. Attending to these aspects requires learning on different dimensions than solely learning to apply techniques (first dimension). It also requires learning to make choices (second dimension) and to understand the rationale behind choices (third dimension). This could be fostered by integrating philosophical training in biomedical data science education. Furthermore, philosophical training fosters a fourth dimension of learning, namely, understanding the nature of science. In this article, we explain how we identified the five aspects of conducting research and the four dimensions of learning, and why attending to the fourth dimension is essential. We discuss educational approaches to attend to all aspects and dimensions, and present initial design principles to implement these approaches.",Scopus,3,2,TRUE,NA,FALSE,TRUE,2022,journal article,Science & Education,NA,NA,Science & Education,"Netherlands, Netherlands",course example and pedagogical approach,TRUE,no data,biomedical science,"From Conclusion: ""We argued that integration of training in philosophy of science in biomedical data science education can increase the achievability of biomedical data science learning goals.""",not applicable,not applicable,"They talk about an hypothetical course, without specifying the department where it would be taught",science,"""Science & Education publishes research informed by the history, philosophy and sociology of science and mathematics that seeks to promote better teaching, learning, and curricula in science and mathematics."" https://link.springer.com/journal/11191/aims-and-scope","They argue that integrating the course of Philosophy of Science in the course of Biomedical Data Science would increase the achievability of both subjects' learning goals (i.e. these disciplines are 'mutually reinforcing'). Their arguments are based on a review of the literature on approaches to biomedical data science education, through which they identify the dimensions that are lacking in the current way in which it is thought, and explaining how this lack could be remedied by integrating philosophical training in biomedical data science education.",NA,not specified
Price_2020_challenges,challenges and approaches to teaching data science technologies in an information technology program with non-traditional students,10.1109/cic48465.2019.00015,https://doi.org/10.1109/cic48465.2019.00015,R. Price; L. Ramaswamy,"Teaching Data Science to traditional CS majors presents many challenges to students, faculty and the supporting infrastructure. When the student population changes from Computer Science students to those in an Information Technology program where many of the core CS courses are not required, additional challenges arise. Couple these challenges with teaching non-traditional students who are also involved with their families and careers; the difficulty in teaching this material rises exponentially. For our experiment, we chose to teach the Hadoop Distributed File System, the Map/Reduce paradigm, and basic Hadoop programming to expose these students to Data Science technologies. We will discuss our recent experience teaching Data Science to Information Technology students and the challenges we had to overcome, including missing distributed systems knowledge, a lack of basic Unix and operating systems understanding and a complete unfamiliarity with a Distributed File System.",IEEE,5,2,TRUE,NA,FALSE,FALSE,2020,conference article,NA,IEEE International Conference on Collaboration and Internet Computing,NA,IEEE International Conference on Collaboration and Internet Computing,"United States of America, United States of America",course example,TRUE,mixed,information technology,"See Introduction ""Our students are enrolled in an Information Technology degree rather than a Computer Science degree"". The paper offers insights for instructors of students in this major.",senior Information Technology Software Development concentration students enrolled in the capstone course,not specified,It was not explicit whether Information Technology and Computer Science are distinct departments,information technology,"""IEEE CIC has been conceived as the key multidisciplinary venue to serve as a premier international forum for discussion among academic and industrial researchers, practitioners, and students interested in Internet technologies, applications and services, collaborative networking, technology and systems, and applications. "" https://www.sis.pitt.edu/lersais/conference/cic/2024/","By reporting on several iterations of a Information Technology Software Development concentration capstone, the authors argue for the need to teach core concepts such as Unix and Distributed Systems before attempting to teach Data Science fundamentals to information technology students.",NA,"big data education, data intensive computing education, data science education"
Raj_2019_data_science,data science education: global perspectives and convergence,10.1145/3304221.3325533,https://doi.org/10.1145/3304221.3325533,"Raj R.K., Parrish A., Impagliazzo J., Romanowski C.J., Ahmed S.A., Bennett C.C., Davis K.C., McGettrick A., Mendes Pereira T.S., Sundin L.",NA,Scopus,3,4,FALSE,presentation summary,FALSE,NA,NA,NA,NA,NA,NA,NA,NA,NA,NA,NA,NA,NA,NA,NA,NA,NA,NA,NA,NA,NA
Raj_2019_empirical_approach,an empirical approach to understanding data science and engineering education,10.1145/3344429.3372503,https://doi.org/10.1145/3344429.3372503,"Raj R.K., Parrish A., Impagliazzo J., Romanowski C.J., Aly S.G., Bennett C.C., Davis K.C., McGettrick A., Pereira T.S.M., Sundin L.","As data science is an evolving field, existing definitions reflect this uncertainty with overloaded terms and inconsistency. As a result of the field's fluidity, there is often a mismatch between what data-related programs teach, what employers expect, and the actual tasks data scientists are performing. In addition, the tools available to data scientists are not necessarily the tools being taught; textbooks do not seem to meet curricular needs; and empirical evidence does not seem to support existing program design. Currently, the field appears to be bifurcating into data science (DS) and data engineering (DE), with specific but overlapping roles in the combined data science and engineering (DSE) lifecycle. However, curriculum design has not yet caught up to this evolution. This working group report shows an empirical and data-driven view of the data-related education landscape, and includes several recommendations for both academia and industry that are based on this analysis.",Scopus,1,2,TRUE,NA,FALSE,TRUE,2019,conference article,NA,ITiCSE-WGR '19: Working Group Reports on Innovation and Technology in Computer Science Education,NA,ITiCSE-WGR '19: Working Group Reports on Innovation and Technology in Computer Science Education,"United States of America, United States of America, United States of America, United States of America, Egypt, United States of America, United States of America, United Kingdom, Portugal, United Kingdom",review of current state of data science education,TRUE,mixed,broad,The goal of the paper is to provide broad recommendations about data science and engineering education,data science professionals,not applicable,due to content area,computer science education,"""A Working Group comprises a team of typically 5 to 10 researchers who work together on a project related to computing education."" https://sigcse.org/events/workinggroups/","This paper tries to better understand the data-science-education space and all its disciplines. It distinguishes disciplines based on two dimensions: (1) the spectrum of raw data to information through the data lifecycle; and (2) the context in which the competencies are executed, ranging from hardware through various levels of software and eventually to the human enterprise. To better understand the data-science-education space, it also looks at a variety of academic and industry-related information such as popular tags on online data-science communities, popular courses in data science programs and most requested technologies in data science job advertisements.",NA,"accreditation, data engineering education, data science education, global standards, iticse 2019 working group, multidisciplinary education"
Rao_2018_milo,milo: a visual programming environment for data science education,10.1109/VLHCC.2018.8506504,https://doi.org/10.1109/VLHCC.2018.8506504,A. Rao; A. Bihani; M. Nair,"Most courses on Data Science offered at universities or online require students to have familiarity with at least one programming language. In this paper, we present, ‚ÄúMilo‚Äù, a web-based visual programming environment for Data Science Education, designed as a pedagogical tool that can be used by students without prior-programming experience. To that end, Milo uses graphical blocks as abstractions of language specific implementations of Data Science and Machine Learning(ML) concepts along with creation of interactive visualizations. Using block definitions created by a user, Milo generates equivalent source code in JavaScript to run entirely in the browser. Based on a preliminary user study with a focus group of undergraduate computer science students, Milo succeeds as an effective tool for novice learners in the field of Data Science.",IEEE,4,2,TRUE,NA,FALSE,TRUE,2018,conference article,NA,2018 IEEE Symposium on Visual Languages and Human-Centric Computing,NA,2018 IEEE Symposium on Visual Languages and Human-Centric Computing,"India, India, India",education technology,FALSE,mixed,broad,"Sec 1: ""we target faculty and educators, who design introductory courses for non-programmers in the fields of Data Science, Machine Learning and Linear Algebra.""",computer science students,computer science,"Quote from Sec. 5(A): ""Participants were selected using a convenience sampling approach from a class of students who were taking their first introductory course in Machine Learning""",computer science,"""The IEEE Symposium on Visual Languages and Human-Centric Computing (VL/HCC) is the premier international forum for research on this topic. Established in 1984, the mission of the conference is to support the design, theory, application, and evaluation of computing technologies and languages for programming, modeling, and communicating, which are easier to learn, use, and understand by people."" https://vlhcc18.github.io/","The authors present a novel visual language targeting new learners in the field of Data Science and Machine Learning, called Milo. This tool targets 'students from high-school to undergraduate students in non-computer science fields'. They do a preliminary evaluation of this tool based on a focus group of 20 undergraduate computer science students. They acknowledge that a real test for the tool will only be when they conduct a user study with non-computer science students.",NA,"data science, machine learning, programming environments, programming profession, tools, visualization"
Rao_2019_data_science,data science education through education data: an end-to-end perspective,10.1109/ISECon.2019.8881970,https://doi.org/10.1109/ISECon.2019.8881970,A. R. Rao; Y. Desai; K. Mishra,"The increasing importance of data science has created a pressing need for more trained professionals. Hence, it is necessary to design efficient education techniques to rapidly train the next generation of students. We describe a holistic approach that integrates multiple objectives within a single semester course taught at the first year level. The objectives include basic data processing techniques, statistical analysis, teamwork, and project management. We conducted a project that combined different public datasets related to the cost and quality of education in the US. Students demonstrated a high degree of involvement in this exercise as they were curious to explore data that related to their own college selection process. It is well known that it is difficult to perform a cost-quality analysis in the field of college education. We used college ranking data created by the Wall Street Journal, and combined it with data from the Integrated Postsecondary Education Data System database (https://nces.ed.gov/ipeds/) that provided college costs and graduation data. Students worked in teams to download sections of the data from multiple sources, performed cleaning and verification, and merged the data for analysis. This taught them the values of teamwork, goal-setting, and process measurement for timely project completion. We determined that the Pearson correlation between the rank of a college and in-state tuition was -0.65 (p<; 0.005) for private colleges, and -0.34 (p<; 0.005) for public colleges. This indicates that higher ranked colleges tend to charge higher tuition. The Pearson correlation between the rank of all colleges and their graduation rates is -0.75 (p<; 0.005), and between rank and retention rates is -0.71 (p<; 0.005). Private college tuition is typically $40,000 annually, whereas public colleges cost $20,000. These figures suggest that public colleges provide good value. This has policy implications for government funding of education.",IEEE,3,1,TRUE,NA,FALSE,FALSE,2019,conference article,NA,2019 IEEE Integrated STEM Education Conference (ISEC),NA,2019 IEEE Integrated STEM Education Conference (ISEC),"United States of America, United States of America, United States of America",course example,FALSE,no data,computer science; engineering,"""This course... is broadly aimed at teaching students in computer science and engineering about different career paths in these fields""",not applicable,engineering,"""We describe a unique approach we adopted at Fairleigh Dickinson University (FDU) that utilizes an end-to-end course experience for first-year students in computer science and engineering. Since there is no specific course designated as ìData Scienceî in the first year, we integrated a data science project within the duration of a one-semester course, ENGR3000, ìModern Technologies: Principles, Applications and Impactsî in the Spring 2018 semester.""",STEM education,"""ISEC is known for featuring cutting-edge research and experiences with integrated approaches to the study of science, math, and technology through experiences and activities based in engineering and other design disciplines."" https://events.vtools.ieee.org/m/191493","Example of a data science course centered around class projects and teamwork with real data from U.S. colleges, cardiac surgery, and Fairleigh Dickinson University alumni.",NA,"computer science, conferences, data science, education, engineering profession, market research, project management"
Robeva_2020_changing,changing the nature of quantitative biology education: data science as a driver,10.1007/s11538-020-00785-0,https://doi.org/10.1007/s11538-020-00785-0,"Robeva RS, Jungck JR, Gross LJ.","We live in a data-rich world with rapidly growing databases with zettabytes of data. Innovation, computation, and technological advances have now tremendously accelerated the pace of discovery, providing driverless cars, robotic devices, expert healthcare systems, precision medicine, and automated discovery to mention a few. Even though the definition of the term data science continues to evolve, the sweeping impact it has already produced on society is undeniable. We are at a point when new discoveries through data science have enormous potential to advance progress but also to be used maliciously, with harmful ethical and social consequences. Perhaps nowhere is this more clearly exemplified than in the biological and medical sciences. The confluence of (1) machine learning, (2) mathematical modeling, (3) computation/simulation, and (4) big data have moved us from the sequencing of genomes to gene editing and individualized medicine; yet, unsettled policies regarding data privacy and ethical norms could potentially open doors for serious negative repercussions. The data science revolution has amplified the urgent need for a paradigm shift in undergraduate biology education. It has reaffirmed that data science education interacts and enhances mathematical education in advancing quantitative conceptual and skill development for the new generation of biologists. These connections encourage us to strive to cultivate a broadly skilled workforce of technologically savvy problem-solvers, skilled at handling the unique challenges pertaining to biological data, and capable of collaborating across various disciplines in the sciences, the humanities, and the social sciences. To accomplish this, we suggest development of open curricula that extend beyond the job certification rhetoric and combine data acumen with modeling, experimental, and computational methods through engaging projects, while also providing awareness and deep exploration of their societal implications. This process would benefit from embracing the pedagogy of experiential learning and involve students in open-ended explorations derived from authentic inquiries and ongoing research. On this foundation, we encourage development of flexible data science initiatives for the education of life science undergraduates within and across existing models.",pubmed,3,4,TRUE,NA,FALSE,TRUE,2020,journal article,Bulletin of Mathematical Biology,NA,NA,Bulletin of Mathematical Biology,"United States of America, United States of America, United States of America",call to action,TRUE,no data,biology; medicine,abstract,not applicable,not applicable,not relevant content area,biology,"From home page: ""As the official journal of the Society for Mathematical Biology, this journal shares research at the biology-mathematics interface. It publishes original research, mathematical biology education, reviews, commentaries, and perspectives."" https://link.springer.com/journal/11538","Discusses the need for data science in undergraduate biology education, overviews the intersection between these topics and the emerging need, and suggest how these two topic areas might be integrated. They suggested a development of open curricula that extend beyond the
job certification rhetoric and combine data acumen with modeling, experimental, and
computational methods through engaging projects, while also providing awareness
and deep exploration of their societal implications.",NA,"big data, data science education, education reform, mathematical biology education"
Romney_2019_curriculum,curriculum for hands-on artificial intelligence cybersecurity,10.1109/ithet46829.2019.8937373,https://doi.org/10.1109/ithet46829.2019.8937373,"Romney G.W., Guymon J., Romney M.D., Carlson D.A.","Interest and awareness of Artificial Intelligence (AI) grows at such a rate that academia and higher education struggle keeping up with the accelerating demand of industry. It is forecast that 75% of enterprise applications will use AI, Machine Learning or Deep Learning technology by 2021, yet university programs commonly place the burden on students to obtain their data science educations through elective coursework spanning multiple disparate departments. Data science requires specific mathematics preparation especially for cybersecurity students whose programs have reduced the requirements for advance mathematics to a bare minimum. To facilitate curricula preparation, and hands-on usage of AI tools, a notebook (‚ÄúA Trellis For Novice AI Practitioners‚Äù) was prepared in the R programming language as a first step in introducing computer science and cybersecurity students to the concepts and capabilities of AI. A focus on an intrusion detection data set to mitigate nine common cyber vulnerabilities is used in this analysis. Trellis bridges the theoretical and practical chasm for students by building an ANN network intrusion predictive model from scratch. It serves as a template but also encourages heavy contextual modification, and may be relied upon in the beginning stages of a cybersecurity practitioner's data science activities on a wide variety of data sets in all areas of the discipline.",Scopus,4,5,TRUE,NA,FALSE,FALSE,2019,conference article,NA,2019 18th International Conference on Information Technology Based Higher Education and Training (ITHET),NA,2019 18th International Conference on Information Technology Based Higher Education and Training (ITHET),"United States of America, United States of America, United States of America, United States of America",class activity example,FALSE,no data,computer science,the article is written for those who teach in computer science and cybersecruity programs,not applicable,not applicable,never implemented in a department,information technology; education,"""Advances in the technologies of our time have permanently altered the educational landscape and continue to have a tremendous impact on changes in teaching. Multimedia is becoming more present and more involved in education. To share the latest technologies and technical advances, the ITHET conference series was established in 2002 by the UNSECO Chair on Mechatronics of Bogazici University, Istanbul."" https://spirit.h2.de/spirit/en/ithet-information-technology-based-higher-education-and-training-2/",They believe that AI should be taught in data science. They develop a notebook for applying data science/machine learning to cybersecurity vulnerability detection.,NA,"ai, deep-belief network, dl, ml, r"
